programming_examples/matrix_multiplication/i8/data1024_i8_rerun.csv
m,k,n,tile_m,tile_k_l2,tile_k_l1,tile_n,latency avg,latency max,latency min
1024,1024,1024,32,32,8,32,1470.2,1729.0,1149.0
1024,1024,1024,32,32,8,64,651.5,694.0,629.0
1024,1024,1024,32,32,8,128,404.3,454.0,395.0
1024,1024,1024,32,32,8,256,318.1,323.0,300.0
1024,1024,1024,32,32,16,32,1316.25,1786.0,1143.0
1024,1024,1024,32,32,16,64,840.1,1267.0,651.0
1024,1024,1024,32,32,16,128,413.7,443.0,391.0
1024,1024,1024,32,32,16,256,307.75,323.0,292.0
1024,1024,1024,32,32,32,32,1149.65,1207.0,1116.0
1024,1024,1024,32,32,32,64,633.3,646.0,614.0
1024,1024,1024,32,32,32,128,395.3,421.0,384.0
1024,1024,1024,32,32,32,256,306.65,339.0,297.0
1024,1024,1024,32,64,8,32,1159.6,1432.0,846.0
1024,1024,1024,32,64,8,64,488.55,500.0,475.0
1024,1024,1024,32,64,8,128,336.05,341.0,324.0
1024,1024,1024,32,64,8,256,253.95,287.0,243.0
1024,1024,1024,32,64,16,32,1163.8,1437.0,834.0
1024,1024,1024,32,64,16,64,552.25,822.0,491.0
1024,1024,1024,32,64,16,128,338.75,381.0,316.0
1024,1024,1024,32,64,16,256,291.9,294.0,284.0
1024,1024,1024,32,64,32,32,1036.6,1305.0,849.0
1024,1024,1024,32,64,32,64,0.0,0.0,0.0
1024,1024,1024,32,64,32,128,335.3,349.0,322.0
1024,1024,1024,32,64,32,256,267.3,286.0,255.0
1024,1024,1024,32,64,64,32,960.75,1460.0,848.0
1024,1024,1024,32,64,64,64,516.95,743.0,491.0
1024,1024,1024,32,64,64,128,333.65,340.0,316.0
1024,1024,1024,32,128,8,32,1097.2,1317.0,830.0
1024,1024,1024,32,128,8,64,511.05,863.0,472.0
1024,1024,1024,32,128,8,128,369.15,640.0,319.0
1024,1024,1024,32,128,8,256,260.95,267.0,246.0
1024,1024,1024,32,128,16,32,937.45,1436.0,859.0
1024,1024,1024,32,128,16,64,745.55,1169.0,487.0
1024,1024,1024,32,128,16,128,343.75,366.0,336.0
1024,1024,1024,32,128,16,256,284.35,319.0,267.0
1024,1024,1024,32,128,32,32,1163.85,1507.0,828.0
1024,1024,1024,32,128,32,64,499.4,506.0,467.0
1024,1024,1024,32,128,32,128,330.15,339.0,305.0
1024,1024,1024,32,128,32,256,0.0,0.0,0.0
1024,1024,1024,32,128,64,32,1105.05,1441.0,833.0
1024,1024,1024,32,128,64,64,498.35,732.0,472.0
1024,1024,1024,32,128,64,128,337.4,360.0,326.0
1024,1024,1024,32,128,128,32,825.35,894.0,804.0
1024,1024,1024,32,128,128,64,503.5,814.0,466.0
1024,1024,1024,32,256,8,32,973.35,1263.0,824.0
1024,1024,1024,32,256,8,64,477.1,511.0,458.0
1024,1024,1024,32,256,8,128,352.8,739.0,320.0
1024,1024,1024,32,256,8,256,301.2,888.0,256.0
1024,1024,1024,32,256,16,32,941.5,1464.0,833.0
1024,1024,1024,32,256,16,64,498.85,507.0,483.0
1024,1024,1024,32,256,16,128,345.9,399.0,332.0
1024,1024,1024,32,256,16,256,312.75,364.0,289.0
1024,1024,1024,32,256,32,32,834.55,842.0,829.0
1024,1024,1024,32,256,32,64,488.75,577.0,470.0
1024,1024,1024,32,256,32,128,318.75,333.0,299.0
1024,1024,1024,32,256,32,256,284.3,330.0,265.0
1024,1024,1024,32,256,64,32,868.4,1185.0,828.0
1024,1024,1024,32,256,64,64,464.55,477.0,455.0
1024,1024,1024,32,256,64,128,317.1,341.0,298.0
1024,1024,1024,32,256,128,32,1180.1,1489.0,827.0
1024,1024,1024,32,256,128,64,499.15,829.0,462.0
1024,1024,1024,32,512,8,32,0.0,0.0,0.0
1024,1024,1024,32,512,8,64,453.45,505.0,426.0
1024,1024,1024,32,512,8,128,304.8,312.0,289.0
1024,1024,1024,32,512,8,256,259.35,269.0,254.0
1024,1024,1024,32,512,16,32,1055.25,1388.0,799.0
1024,1024,1024,32,512,16,64,464.3,504.0,449.0
1024,1024,1024,32,512,16,128,339.25,372.0,322.0
1024,1024,1024,32,512,16,256,298.65,318.0,272.0
1024,1024,1024,32,512,32,32,1083.65,1424.0,785.0
1024,1024,1024,32,512,32,64,654.55,803.0,470.0
1024,1024,1024,32,512,32,128,359.05,731.0,304.0
1024,1024,1024,32,512,32,256,246.5,260.0,240.0
1024,1024,1024,32,512,64,32,750.45,783.0,735.0
1024,1024,1024,32,512,64,64,436.05,462.0,422.0
1024,1024,1024,32,512,64,128,312.2,318.0,295.0
1024,1024,1024,32,512,128,32,891.9,1114.0,749.0
1024,1024,1024,32,512,128,64,449.4,502.0,430.0
1024,1024,1024,32,1024,8,32,1133.65,1397.0,803.0
1024,1024,1024,32,1024,8,64,0.0,0.0,0.0
1024,1024,1024,32,1024,8,128,360.8,364.0,354.0
1024,1024,1024,32,1024,8,256,317.65,329.0,300.0
1024,1024,1024,32,1024,16,32,1130.1,1517.0,864.0
1024,1024,1024,32,1024,16,64,588.9,609.0,579.0
1024,1024,1024,32,1024,16,128,462.2,801.0,428.0
1024,1024,1024,32,1024,16,256,373.45,378.0,358.0
1024,1024,1024,32,1024,32,32,1161.9,1399.0,841.0
1024,1024,1024,32,1024,32,64,601.15,881.0,539.0
1024,1024,1024,32,1024,32,128,391.4,468.0,371.0
1024,1024,1024,32,1024,32,256,332.45,350.0,310.0
1024,1024,1024,32,1024,64,32,0.0,0.0,0.0
1024,1024,1024,32,1024,64,64,493.1,519.0,476.0
1024,1024,1024,32,1024,64,128,342.2,368.0,332.0
1024,1024,1024,32,1024,128,32,731.65,1041.0,670.0
1024,1024,1024,32,1024,128,64,499.7,506.0,489.0
1024,1024,1024,64,32,8,32,0.0,0.0,0.0
1024,1024,1024,64,32,8,64,683.2,1108.0,526.0
1024,1024,1024,64,32,8,128,363.6,401.0,343.0
1024,1024,1024,64,32,8,256,287.15,330.0,271.0
1024,1024,1024,64,32,16,32,1244.35,1550.0,921.0
1024,1024,1024,64,32,16,64,536.2,553.0,520.0
1024,1024,1024,64,32,16,128,357.45,361.0,351.0
1024,1024,1024,64,32,16,256,266.4,301.0,249.0
1024,1024,1024,64,32,32,32,1087.7,1542.0,882.0
1024,1024,1024,64,32,32,64,520.4,533.0,503.0
1024,1024,1024,64,32,32,128,344.2,349.0,328.0
1024,1024,1024,64,64,8,32,0.0,0.0,0.0
1024,1024,1024,64,64,8,64,418.2,757.0,388.0
1024,1024,1024,64,64,8,128,272.1,279.0,262.0
1024,1024,1024,64,64,8,256,222.2,230.0,204.0
1024,1024,1024,64,64,16,32,1038.85,1368.0,679.0
1024,1024,1024,64,64,16,64,407.75,510.0,388.0
1024,1024,1024,64,64,16,128,324.7,909.0,281.0
1024,1024,1024,64,64,16,256,281.2,288.0,264.0
1024,1024,1024,64,64,32,32,977.4,1264.0,661.0
1024,1024,1024,64,64,32,64,0.0,0.0,0.0
1024,1024,1024,64,64,32,128,251.05,254.0,238.0
1024,1024,1024,64,64,64,32,629.25,648.0,624.0
1024,1024,1024,64,64,64,64,397.45,404.0,369.0
1024,1024,1024,64,128,8,32,916.35,1334.0,646.0
1024,1024,1024,64,128,8,64,372.85,378.0,361.0
1024,1024,1024,64,128,8,128,260.1,269.0,250.0
1024,1024,1024,64,128,8,256,242.3,336.0,217.0
1024,1024,1024,64,128,16,32,655.8,669.0,638.0
1024,1024,1024,64,128,16,64,422.25,748.0,394.0
1024,1024,1024,64,128,16,128,281.65,284.0,278.0
1024,1024,1024,64,128,16,256,275.2,289.0,263.0
1024,1024,1024,64,128,32,32,652.25,660.0,636.0
1024,1024,1024,64,128,32,64,400.6,413.0,392.0
1024,1024,1024,64,128,32,128,281.05,285.0,267.0
1024,1024,1024,64,128,64,32,1063.95,1351.0,647.0
1024,1024,1024,64,128,64,64,409.4,675.0,376.0
1024,1024,1024,64,128,128,32,651.95,681.0,636.0
1024,1024,1024,64,256,8,32,739.9,1320.0,627.0
1024,1024,1024,64,256,8,64,368.75,457.0,341.0
1024,1024,1024,64,256,8,128,259.35,303.0,243.0
1024,1024,1024,64,256,8,256,243.8,533.0,206.0
1024,1024,1024,64,256,16,32,697.1,1021.0,621.0
1024,1024,1024,64,256,16,64,389.85,442.0,374.0
1024,1024,1024,64,256,16,128,300.7,346.0,278.0
1024,1024,1024,64,256,16,256,287.2,291.0,272.0
1024,1024,1024,64,256,32,32,629.65,637.0,617.0
1024,1024,1024,64,256,32,64,393.3,411.0,384.0
1024,1024,1024,64,256,32,128,272.2,306.0,250.0
1024,1024,1024,64,256,64,32,703.25,1221.0,594.0
1024,1024,1024,64,256,64,64,385.45,393.0,369.0
1024,1024,1024,64,256,128,32,958.4,1315.0,616.0
1024,1024,1024,64,512,8,32,634.4,929.0,536.0
1024,1024,1024,64,512,8,64,331.4,385.0,313.0
1024,1024,1024,64,512,8,128,240.85,281.0,212.0
1024,1024,1024,64,512,8,256,191.85,216.0,183.0
1024,1024,1024,64,512,16,32,579.4,595.0,560.0
1024,1024,1024,64,512,16,64,349.9,365.0,341.0
1024,1024,1024,64,512,16,128,278.9,283.0,267.0
1024,1024,1024,64,512,16,256,0.0,0.0,0.0
1024,1024,1024,64,512,32,32,608.95,1082.0,540.0
1024,1024,1024,64,512,32,64,347.15,423.0,321.0
1024,1024,1024,64,512,32,128,243.8,248.0,232.0
1024,1024,1024,64,512,64,32,627.9,1017.0,543.0
1024,1024,1024,64,512,64,64,348.7,355.0,332.0
1024,1024,1024,64,512,128,32,554.05,558.0,546.0
1024,1024,1024,64,1024,8,32,550.45,564.0,536.0
1024,1024,1024,64,1024,8,64,366.65,390.0,355.0
1024,1024,1024,64,1024,8,128,315.9,558.0,247.0
1024,1024,1024,64,1024,8,256,240.75,245.0,230.0
1024,1024,1024,64,1024,16,32,663.5,708.0,648.0
1024,1024,1024,64,1024,16,64,467.75,475.0,465.0
1024,1024,1024,64,1024,16,128,408.1,685.0,354.0
1024,1024,1024,64,1024,16,256,328.4,333.0,313.0
1024,1024,1024,64,1024,32,32,807.7,1258.0,620.0
1024,1024,1024,64,1024,32,64,420.45,448.0,398.0
1024,1024,1024,64,1024,32,128,325.3,335.0,304.0
1024,1024,1024,64,1024,64,32,703.35,1049.0,550.0
1024,1024,1024,64,1024,64,64,451.25,879.0,364.0
1024,1024,1024,64,1024,128,32,620.3,840.0,520.0
1024,1024,1024,128,32,8,32,944.95,963.0,936.0
1024,1024,1024,128,32,8,64,555.4,653.0,532.0
1024,1024,1024,128,32,8,128,339.15,347.0,322.0
1024,1024,1024,128,32,16,32,929.45,1211.0,891.0
1024,1024,1024,128,32,16,64,583.95,1048.0,526.0
1024,1024,1024,128,32,16,128,407.65,900.0,329.0
1024,1024,1024,128,32,32,32,1166.25,1554.0,840.0
1024,1024,1024,128,32,32,64,531.1,838.0,500.0
1024,1024,1024,128,64,8,32,830.55,1051.0,606.0
1024,1024,1024,128,64,8,64,375.2,388.0,358.0
1024,1024,1024,128,64,8,128,238.9,254.0,234.0
1024,1024,1024,128,64,16,32,602.45,623.0,588.0
1024,1024,1024,128,64,16,64,372.5,378.0,361.0
1024,1024,1024,128,64,16,128,263.65,288.0,239.0
1024,1024,1024,128,64,32,32,715.5,942.0,562.0
1024,1024,1024,128,64,32,64,363.8,463.0,344.0
1024,1024,1024,128,64,64,32,569.9,829.0,545.0
1024,1024,1024,128,128,8,32,614.45,658.0,591.0
1024,1024,1024,128,128,8,64,385.4,397.0,368.0
1024,1024,1024,128,128,8,128,236.15,242.0,219.0
1024,1024,1024,128,128,16,32,606.3,612.0,590.0
1024,1024,1024,128,128,16,64,370.75,394.0,341.0
1024,1024,1024,128,128,16,128,281.25,288.0,272.0
1024,1024,1024,128,128,32,32,607.95,619.0,601.0
1024,1024,1024,128,128,32,64,376.7,397.0,364.0
1024,1024,1024,128,128,64,32,857.8,1131.0,577.0
1024,1024,1024,128,256,8,32,797.35,1190.0,566.0
1024,1024,1024,128,256,8,64,354.6,388.0,335.0
1024,1024,1024,128,256,8,128,255.15,262.0,243.0
1024,1024,1024,128,256,16,32,684.45,890.0,587.0
1024,1024,1024,128,256,16,64,373.1,378.0,357.0
1024,1024,1024,128,256,16,128,294.05,314.0,269.0
1024,1024,1024,128,256,32,32,869.7,1203.0,596.0
1024,1024,1024,128,256,32,64,347.2,351.0,336.0
1024,1024,1024,128,256,64,32,569.05,575.0,553.0
1024,1024,1024,128,512,8,32,0.0,0.0,0.0
1024,1024,1024,128,512,8,64,287.5,321.0,263.0
1024,1024,1024,128,512,8,128,210.55,219.0,204.0
1024,1024,1024,128,512,16,32,500.5,809.0,461.0
1024,1024,1024,128,512,16,64,375.6,793.0,314.0
1024,1024,1024,128,512,16,128,280.5,289.0,263.0
1024,1024,1024,128,512,32,32,467.45,490.0,453.0
1024,1024,1024,128,512,32,64,0.0,0.0,0.0
1024,1024,1024,128,512,64,32,451.75,481.0,438.0
1024,1024,1024,128,1024,8,32,504.85,519.0,483.0
1024,1024,1024,128,1024,8,64,324.8,331.0,316.0
1024,1024,1024,128,1024,8,128,204.05,209.0,195.0
1024,1024,1024,128,1024,16,32,572.3,577.0,555.0
1024,1024,1024,128,1024,16,64,424.3,515.0,403.0
1024,1024,1024,128,1024,16,128,346.35,351.0,331.0
1024,1024,1024,128,1024,32,32,526.5,571.0,512.0
1024,1024,1024,128,1024,32,64,368.2,372.0,352.0
1024,1024,1024,128,1024,64,32,494.95,527.0,475.0
1024,1024,1024,256,32,8,32,398.7,407.0,394.0
1024,1024,1024,256,32,8,64,2.04683,4.0,2894.0
1024,1024,1024,256,32,16,32,405.05,414.0,378.0
1024,1024,1024,256,32,16,64,1.22792,4.0,320.0
1024,1024,1024,256,32,32,32,390.45,400.0,377.0
1024,1024,1024,256,64,8,32,416.9,508.0,394.0
1024,1024,1024,256,64,8,64,1.84254,4.0,374.0
1024,1024,1024,256,64,16,32,425.3,535.0,402.0
1024,1024,1024,256,64,16,64,1.43233,4.0,329.0
1024,1024,1024,256,64,32,32,408.7,415.0,396.0
1024,1024,1024,256,128,8,32,404.35,422.0,397.0
1024,1024,1024,256,128,8,64,1.84232,4.0,354.0
1024,1024,1024,256,128,16,32,408.25,534.0,379.0
1024,1024,1024,256,128,16,64,1.6372,4.0,321.0
1024,1024,1024,256,128,32,32,397.5,436.0,386.0
1024,1024,1024,256,256,8,32,418.3,495.0,398.0
1024,1024,1024,256,256,8,64,1.84197,4.0,345.0
1024,1024,1024,256,256,16,32,408.5,411.0,394.0
1024,1024,1024,256,256,16,64,1.63773,4.0,335.0
1024,1024,1024,256,256,32,32,423.85,493.0,394.0
1024,1024,1024,256,512,8,32,417.6,465.0,409.0
1024,1024,1024,256,512,8,64,2.04692,4.0,2884.0
1024,1024,1024,256,512,16,32,451.9,521.0,432.0
1024,1024,1024,256,512,16,64,2.04678,4.0,3190.0
1024,1024,1024,256,512,32,32,438.8,443.0,429.0
