programming_examples/matrix_multiplication/i16/data1.csv
m,k,n,tile_m,tile_k_l2,tile_k_l1,tile_n,latency avg,latency max,latency min
1024,1024,1024,16,8,8,16,5840.35,6104.0,5500.0
1024,1024,1024,16,8,8,32,3063.15,3270.0,2984.0
1024,1024,1024,16,8,8,64,1705.2,2006.0,1465.0
1024,1024,1024,16,8,8,128,1374.85,1613.0,1107.0
1024,1024,1024,16,8,8,256,969.5,1368.0,775.0
1024,1024,1024,16,16,8,16,4019.15,4182.0,3722.0
1024,1024,1024,16,16,8,32,2016.45,2408.0,1978.0
1024,1024,1024,16,16,8,64,1171.8,1185.0,1165.0
1024,1024,1024,16,16,8,128,1071.85,1430.0,743.0
1024,1024,1024,16,16,8,256,963.05,1317.0,649.0
1024,1024,1024,16,16,16,16,4076.85,4299.0,3731.0
1024,1024,1024,16,16,16,32,2279.25,2438.0,2006.0
1024,1024,1024,16,16,16,64,1329.3,1823.0,1119.0
1024,1024,1024,16,16,16,128,921.5,1429.0,734.0
1024,1024,1024,16,16,16,256,866.05,1200.0,606.0
1024,1024,1024,16,32,8,16,3143.7,3436.0,2930.0
1024,1024,1024,16,32,8,32,1779.5,2148.0,1531.0
1024,1024,1024,16,32,8,64,920.6,969.0,893.0
1024,1024,1024,16,32,8,128,620.8,651.0,602.0
1024,1024,1024,16,32,8,256,0.0,0.0,0.0
1024,1024,1024,16,32,16,16,3172.6,3450.0,2899.0
1024,1024,1024,16,32,16,32,1531.5,1573.0,1518.0
1024,1024,1024,16,32,16,64,954.2,1217.0,889.0
1024,1024,1024,16,32,16,128,880.5,1222.0,587.0
1024,1024,1024,16,32,16,256,782.75,1125.0,542.0
1024,1024,1024,16,32,32,16,3354.8,3528.0,3074.0
1024,1024,1024,16,32,32,32,1873.1,2376.0,1664.0
1024,1024,1024,16,32,32,64,1065.4,1635.0,901.0
1024,1024,1024,16,32,32,128,0.0,0.0,0.0
1024,1024,1024,16,32,32,256,570.95,839.0,533.0
1024,1024,1024,16,64,8,16,3073.8,3304.0,2776.0
1024,1024,1024,16,64,8,32,0.0,0.0,0.0
1024,1024,1024,16,64,8,64,1215.1,1596.0,886.0
1024,1024,1024,16,64,8,128,749.85,1187.0,645.0
1024,1024,1024,16,64,8,256,553.2,573.0,541.0
1024,1024,1024,16,64,16,16,3083.8,3672.0,2796.0
1024,1024,1024,16,64,16,32,1466.9,1767.0,1436.0
1024,1024,1024,16,64,16,64,890.1,938.0,864.0
1024,1024,1024,16,64,16,128,639.65,685.0,624.0
1024,1024,1024,16,64,16,256,814.9,1176.0,544.0
1024,1024,1024,16,64,32,16,3023.9,3378.0,2787.0
1024,1024,1024,16,64,32,32,1824.85,2112.0,1495.0
1024,1024,1024,16,64,32,64,901.4,923.0,875.0
1024,1024,1024,16,64,32,128,769.05,1260.0,622.0
1024,1024,1024,16,64,32,256,0.0,0.0,0.0
1024,1024,1024,16,64,64,16,2932.85,3254.0,2751.0
1024,1024,1024,16,64,64,32,0.0,0.0,0.0
1024,1024,1024,16,64,64,64,894.05,900.0,880.0
1024,1024,1024,16,64,64,128,624.45,669.0,617.0
1024,1024,1024,16,128,8,16,2738.15,3341.0,2677.0
1024,1024,1024,16,128,8,32,1428.15,1457.0,1419.0
1024,1024,1024,16,128,8,64,0.0,0.0,0.0
1024,1024,1024,16,128,8,128,884.85,1276.0,636.0
1024,1024,1024,16,128,8,256,818.3,1235.0,563.0
1024,1024,1024,16,128,16,16,3053.05,3533.0,2687.0
1024,1024,1024,16,128,16,32,1623.35,1923.0,1396.0
1024,1024,1024,16,128,16,64,1127.7,1474.0,833.0
1024,1024,1024,16,128,16,128,617.5,635.0,604.0
1024,1024,1024,16,128,16,256,539.55,561.0,529.0
1024,1024,1024,16,128,32,16,3016.1,3292.0,2709.0
1024,1024,1024,16,128,32,32,1702.55,2021.0,1433.0
1024,1024,1024,16,128,32,64,1136.7,1484.0,826.0
1024,1024,1024,16,128,32,128,766.05,1158.0,610.0
1024,1024,1024,16,128,32,256,0.0,0.0,0.0
1024,1024,1024,16,128,64,16,3013.95,3326.0,2701.0
1024,1024,1024,16,128,64,32,1619.1,1935.0,1404.0
1024,1024,1024,16,128,64,64,1184.2,1517.0,841.0
1024,1024,1024,16,128,64,128,704.65,1182.0,588.0
1024,1024,1024,16,128,128,16,3059.95,3271.0,2713.0
1024,1024,1024,16,128,128,32,1614.3,2080.0,1378.0
1024,1024,1024,16,128,128,64,1144.95,1548.0,849.0
1024,1024,1024,16,256,8,16,0.0,0.0,0.0
1024,1024,1024,16,256,8,32,1725.75,1973.0,1637.0
1024,1024,1024,16,256,8,64,1181.75,1478.0,796.0
1024,1024,1024,16,256,8,128,632.6,911.0,578.0
1024,1024,1024,16,256,8,256,0.0,0.0,0.0
1024,1024,1024,16,256,16,16,2792.3,3499.0,2624.0
1024,1024,1024,16,256,16,32,1602.05,1985.0,1375.0
1024,1024,1024,16,256,16,64,777.65,791.0,765.0
1024,1024,1024,16,256,16,128,571.5,582.0,567.0
1024,1024,1024,16,256,16,256,647.2,1126.0,526.0
1024,1024,1024,16,256,32,16,2859.45,3261.0,2578.0
1024,1024,1024,16,256,32,32,1565.75,1946.0,1353.0
1024,1024,1024,16,256,32,64,1134.85,1392.0,800.0
1024,1024,1024,16,256,32,128,559.2,573.0,552.0
1024,1024,1024,16,256,32,256,524.15,544.0,514.0
1024,1024,1024,16,256,64,16,2784.15,3063.0,2662.0
1024,1024,1024,16,256,64,32,1349.7,1364.0,1337.0
1024,1024,1024,16,256,64,64,1060.75,1351.0,806.0
1024,1024,1024,16,256,64,128,803.4,1040.0,564.0
1024,1024,1024,16,256,128,16,2931.55,3161.0,2611.0
1024,1024,1024,16,256,128,32,1711.25,2038.0,1620.0
1024,1024,1024,16,256,128,64,876.2,1267.0,796.0
1024,1024,1024,16,256,256,16,3005.05,3239.0,2681.0
1024,1024,1024,16,256,256,32,1533.2,1885.0,1323.0
1024,1024,1024,16,512,8,16,2830.05,3546.0,2622.0
1024,1024,1024,16,512,8,32,1438.9,1454.0,1425.0
1024,1024,1024,16,512,8,64,909.3,1507.0,802.0
1024,1024,1024,16,512,8,128,926.95,1278.0,596.0
1024,1024,1024,16,512,8,256,0.0,0.0,0.0
1024,1024,1024,16,512,16,16,2881.3,3222.0,2568.0
1024,1024,1024,16,512,16,32,1546.5,1738.0,1391.0
1024,1024,1024,16,512,16,64,1132.75,1496.0,791.0
1024,1024,1024,16,512,16,128,574.8,604.0,565.0
1024,1024,1024,16,512,16,256,927.9,1209.0,612.0
1024,1024,1024,16,512,32,16,2944.15,3337.0,2656.0
1024,1024,1024,16,512,32,32,1700.3,1990.0,1514.0
1024,1024,1024,16,512,32,64,1034.85,1403.0,784.0
1024,1024,1024,16,512,32,128,841.05,1269.0,563.0
1024,1024,1024,16,512,32,256,958.4,1198.0,590.0
1024,1024,1024,16,512,64,16,2973.65,3266.0,2638.0
1024,1024,1024,16,512,64,32,1744.55,2106.0,1407.0
1024,1024,1024,16,512,64,64,1131.5,1486.0,827.0
1024,1024,1024,16,512,64,128,566.9,585.0,561.0
1024,1024,1024,16,512,128,16,2993.2,3468.0,2860.0
1024,1024,1024,16,512,128,32,1363.45,1509.0,1342.0
1024,1024,1024,16,512,128,64,787.05,840.0,778.0
1024,1024,1024,16,512,256,16,2880.65,3330.0,2559.0
1024,1024,1024,16,512,256,32,1342.8,1368.0,1332.0
1024,1024,1024,16,1024,8,16,3132.55,3164.0,3118.0
1024,1024,1024,16,1024,8,32,2093.75,2551.0,1941.0
1024,1024,1024,16,1024,8,64,1436.15,1588.0,1243.0
1024,1024,1024,16,1024,8,128,1240.65,1468.0,922.0
1024,1024,1024,16,1024,8,256,1342.2,1615.0,950.0
1024,1024,1024,16,1024,16,16,2544.7,2572.0,2526.0
1024,1024,1024,16,1024,16,32,2008.25,2366.0,1750.0
1024,1024,1024,16,1024,16,64,1489.5,1693.0,1145.0
1024,1024,1024,16,1024,16,128,1083.75,1568.0,864.0
1024,1024,1024,16,1024,16,256,1127.7,1462.0,834.0
1024,1024,1024,16,1024,32,16,2873.55,3433.0,2603.0
1024,1024,1024,16,1024,32,32,1613.3,1625.0,1588.0
1024,1024,1024,16,1024,32,64,1379.4,1620.0,1037.0
1024,1024,1024,16,1024,32,128,1094.3,1419.0,784.0
1024,1024,1024,16,1024,32,256,958.15,1384.0,791.0
1024,1024,1024,16,1024,64,16,2747.1,2938.0,2471.0
1024,1024,1024,16,1024,64,32,2018.05,2141.0,1885.0
1024,1024,1024,16,1024,64,64,1519.95,1636.0,1341.0
1024,1024,1024,16,1024,64,128,788.3,843.0,777.0
1024,1024,1024,16,1024,128,16,2406.65,2457.0,2391.0
1024,1024,1024,16,1024,128,32,1723.65,1985.0,1578.0
1024,1024,1024,16,1024,128,64,988.3,1010.0,974.0
1024,1024,1024,16,1024,256,16,2875.25,3283.0,2585.0
1024,1024,1024,16,1024,256,32,1571.6,1613.0,1560.0
1024,1024,1024,32,8,8,16,5231.7,5605.0,5081.0
1024,1024,1024,32,8,8,32,2959.4,3442.0,2820.0
1024,1024,1024,32,8,8,64,1597.65,2064.0,1404.0
1024,1024,1024,32,8,8,128,814.9,881.0,799.0
1024,1024,1024,32,8,8,256,842.75,1307.0,677.0
1024,1024,1024,32,16,8,16,3494.75,4220.0,3065.0
1024,1024,1024,32,16,8,32,0.0,0.0,0.0
1024,1024,1024,32,16,8,64,1235.65,1562.0,911.0
1024,1024,1024,32,16,8,128,808.7,1145.0,639.0
1024,1024,1024,32,16,8,256,533.45,804.0,504.0
1024,1024,1024,32,16,16,16,3046.15,3217.0,2829.0
1024,1024,1024,32,16,16,32,1997.9,2115.0,1844.0
1024,1024,1024,32,16,16,64,1223.05,1586.0,871.0
1024,1024,1024,32,16,16,128,952.15,1270.0,619.0
1024,1024,1024,32,16,16,256,470.55,490.0,454.0
1024,1024,1024,32,32,8,16,2453.1,2604.0,2416.0
1024,1024,1024,32,32,8,32,1317.05,1757.0,1142.0
1024,1024,1024,32,32,8,64,996.85,1294.0,696.0
1024,1024,1024,32,32,8,128,502.65,507.0,494.0
1024,1024,1024,32,32,8,256,0.0,0.0,0.0
1024,1024,1024,32,32,16,16,2394.25,2555.0,2123.0
1024,1024,1024,32,32,16,32,1456.8,1754.0,1090.0
1024,1024,1024,32,32,16,64,1011.45,1362.0,679.0
1024,1024,1024,32,32,16,128,505.7,826.0,474.0
1024,1024,1024,32,32,16,256,466.8,769.0,439.0
1024,1024,1024,32,32,32,16,2432.25,2697.0,2245.0
1024,1024,1024,32,32,32,32,1486.65,1728.0,1405.0
1024,1024,1024,32,32,32,64,672.7,678.0,658.0
1024,1024,1024,32,32,32,128,459.7,483.0,454.0
1024,1024,1024,32,32,32,256,408.05,431.0,393.0
1024,1024,1024,32,64,8,16,2310.9,2663.0,2060.0
1024,1024,1024,32,64,8,32,1369.35,1520.0,1166.0
1024,1024,1024,32,64,8,64,950.8,1126.0,666.0
1024,1024,1024,32,64,8,128,527.65,548.0,516.0
1024,1024,1024,32,64,8,256,501.1,528.0,493.0
1024,1024,1024,32,64,16,16,2383.25,2955.0,2015.0
1024,1024,1024,32,64,16,32,1191.9,1653.0,1081.0
1024,1024,1024,32,64,16,64,930.55,1161.0,663.0
1024,1024,1024,32,64,16,128,501.6,792.0,475.0
1024,1024,1024,32,64,16,256,428.7,455.0,412.0
1024,1024,1024,32,64,32,16,2387.95,2644.0,2014.0
1024,1024,1024,32,64,32,32,1474.3,1633.0,1099.0
1024,1024,1024,32,64,32,64,787.1,1277.0,681.0
1024,1024,1024,32,64,32,128,524.95,824.0,457.0
1024,1024,1024,32,64,32,256,472.65,737.0,409.0
1024,1024,1024,32,64,64,16,2335.2,2586.0,2028.0
1024,1024,1024,32,64,64,32,1427.65,1710.0,1385.0
1024,1024,1024,32,64,64,64,649.8,659.0,645.0
1024,1024,1024,32,64,64,128,0.0,0.0,0.0
1024,1024,1024,32,128,8,16,2171.2,2871.0,1935.0
1024,1024,1024,32,128,8,32,0.0,0.0,0.0
1024,1024,1024,32,128,8,64,977.1,1344.0,680.0
1024,1024,1024,32,128,8,128,598.4,1065.0,516.0
1024,1024,1024,32,128,8,256,520.45,794.0,493.0
1024,1024,1024,32,128,16,16,2322.05,2535.0,1994.0
1024,1024,1024,32,128,16,32,1473.65,1763.0,1140.0
1024,1024,1024,32,128,16,64,650.9,700.0,635.0
1024,1024,1024,32,128,16,128,508.75,656.0,483.0
1024,1024,1024,32,128,16,256,543.45,759.0,426.0
1024,1024,1024,32,128,32,16,2228.05,2521.0,1954.0
1024,1024,1024,32,128,32,32,1360.8,1544.0,1106.0
1024,1024,1024,32,128,32,64,967.45,1295.0,631.0
1024,1024,1024,32,128,32,128,498.65,827.0,474.0
1024,1024,1024,32,128,32,256,396.55,436.0,380.0
1024,1024,1024,32,128,64,16,2282.75,2553.0,1918.0
1024,1024,1024,32,128,64,32,1248.35,1863.0,1041.0
1024,1024,1024,32,128,64,64,924.9,1314.0,626.0
1024,1024,1024,32,128,64,128,488.3,801.0,452.0
1024,1024,1024,32,128,128,16,2207.35,2629.0,1923.0
1024,1024,1024,32,128,128,32,1293.65,1721.0,1036.0
1024,1024,1024,32,128,128,64,960.9,1214.0,623.0
1024,1024,1024,32,256,8,16,1668.8,1697.0,1655.0
1024,1024,1024,32,256,8,32,944.1,957.0,937.0
1024,1024,1024,32,256,8,64,610.85,619.0,594.0
1024,1024,1024,32,256,8,128,516.45,536.0,510.0
1024,1024,1024,32,256,8,256,519.15,534.0,509.0
1024,1024,1024,32,256,16,16,1677.5,1694.0,1652.0
1024,1024,1024,32,256,16,32,1096.4,1426.0,919.0
1024,1024,1024,32,256,16,64,866.8,1189.0,570.0
1024,1024,1024,32,256,16,128,471.35,478.0,458.0
1024,1024,1024,32,256,16,256,482.1,795.0,454.0
1024,1024,1024,32,256,32,16,1981.65,2300.0,1694.0
1024,1024,1024,32,256,32,32,1298.15,1598.0,894.0
1024,1024,1024,32,256,32,64,666.4,1031.0,535.0
1024,1024,1024,32,256,32,128,421.05,504.0,414.0
1024,1024,1024,32,256,32,256,433.55,777.0,383.0
1024,1024,1024,32,256,64,16,1975.55,2354.0,1675.0
1024,1024,1024,32,256,64,32,1065.95,1577.0,918.0
1024,1024,1024,32,256,64,64,788.55,1193.0,548.0
1024,1024,1024,32,256,64,128,380.05,409.0,360.0
1024,1024,1024,32,256,128,16,1891.8,2191.0,1661.0
1024,1024,1024,32,256,128,32,1180.35,1436.0,925.0
1024,1024,1024,32,256,128,64,614.55,871.0,545.0
1024,1024,1024,32,256,256,16,2024.1,2286.0,1707.0
1024,1024,1024,32,512,8,16,2032.5,2209.0,1977.0
1024,1024,1024,32,512,8,32,1113.3,1610.0,930.0
1024,1024,1024,32,512,8,64,1020.6,1275.0,636.0
1024,1024,1024,32,512,8,128,0.0,0.0,0.0
1024,1024,1024,32,512,8,256,633.05,992.0,524.0
1024,1024,1024,32,512,16,16,1688.2,1713.0,1667.0
1024,1024,1024,32,512,16,32,1199.8,1547.0,903.0
1024,1024,1024,32,512,16,64,733.4,1097.0,571.0
1024,1024,1024,32,512,16,128,538.15,796.0,467.0
1024,1024,1024,32,512,16,256,498.1,776.0,461.0
1024,1024,1024,32,512,32,16,1916.4,2263.0,1680.0
1024,1024,1024,32,512,32,32,1138.75,1480.0,905.0
1024,1024,1024,32,512,32,64,568.65,863.0,528.0
1024,1024,1024,32,512,32,128,415.15,488.0,396.0
1024,1024,1024,32,512,32,256,422.4,514.0,409.0
1024,1024,1024,32,512,64,16,2008.85,2230.0,1729.0
1024,1024,1024,32,512,64,32,1197.9,1478.0,905.0
1024,1024,1024,32,512,64,64,576.55,873.0,532.0
1024,1024,1024,32,512,64,128,400.65,422.0,385.0
1024,1024,1024,32,512,128,16,1928.2,2229.0,1673.0
1024,1024,1024,32,512,128,32,876.7,887.0,859.0
1024,1024,1024,32,512,128,64,539.95,567.0,520.0
1024,1024,1024,32,512,256,16,1689.8,1782.0,1675.0
1024,1024,1024,32,1024,8,16,2125.9,2615.0,2041.0
1024,1024,1024,32,1024,8,32,1399.85,1410.0,1394.0
1024,1024,1024,32,1024,8,64,931.7,943.0,912.0
1024,1024,1024,32,1024,8,128,717.65,736.0,709.0
1024,1024,1024,32,1024,8,256,1053.8,1401.0,739.0
1024,1024,1024,32,1024,16,16,2346.1,2611.0,2225.0
1024,1024,1024,32,1024,16,32,1524.45,1776.0,1248.0
1024,1024,1024,32,1024,16,64,1229.4,1545.0,840.0
1024,1024,1024,32,1024,16,128,820.3,1256.0,662.0
1024,1024,1024,32,1024,16,256,943.45,1221.0,669.0
1024,1024,1024,32,1024,32,16,2195.2,2426.0,1944.0
1024,1024,1024,32,1024,32,32,1435.05,1731.0,1140.0
1024,1024,1024,32,1024,32,64,795.25,1087.0,726.0
1024,1024,1024,32,1024,32,128,644.4,983.0,547.0
1024,1024,1024,32,1024,32,256,772.2,1052.0,562.0
1024,1024,1024,32,1024,64,16,2310.15,2558.0,2218.0
1024,1024,1024,32,1024,64,32,1144.3,1170.0,1123.0
1024,1024,1024,32,1024,64,64,684.4,691.0,672.0
1024,1024,1024,32,1024,64,128,535.85,550.0,517.0
1024,1024,1024,32,1024,128,16,2142.85,2355.0,1918.0
1024,1024,1024,32,1024,128,32,1410.95,1659.0,1126.0
1024,1024,1024,32,1024,128,64,892.5,1221.0,656.0
1024,1024,1024,32,1024,256,16,1967.25,2333.0,1793.0
1024,1024,1024,64,8,8,16,5583.45,5806.0,5278.0
1024,1024,1024,64,8,8,32,3098.5,3254.0,3052.0
1024,1024,1024,64,8,8,64,1760.3,2037.0,1498.0
1024,1024,1024,64,8,8,128,1079.65,1381.0,839.0
1024,1024,1024,64,8,8,256,619.55,1117.0,531.0
1024,1024,1024,64,16,8,16,3250.05,3554.0,2909.0
1024,1024,1024,64,16,8,32,1558.2,1566.0,1542.0
1024,1024,1024,64,16,8,64,878.25,885.0,865.0
1024,1024,1024,64,16,8,128,667.75,1159.0,541.0
1024,1024,1024,64,16,8,256,463.75,468.0,457.0
1024,1024,1024,64,16,16,16,2861.3,3230.0,2627.0
1024,1024,1024,64,16,16,32,1861.55,2440.0,1496.0
1024,1024,1024,64,16,16,64,802.5,813.0,792.0
1024,1024,1024,64,16,16,128,505.5,521.0,491.0
1024,1024,1024,64,16,16,256,0.0,0.0,0.0
1024,1024,1024,64,32,8,16,2091.55,2572.0,1811.0
1024,1024,1024,64,32,8,32,1261.6,1648.0,995.0
1024,1024,1024,64,32,8,64,572.3,598.0,558.0
1024,1024,1024,64,32,8,128,490.35,801.0,462.0
1024,1024,1024,64,32,8,256,457.15,503.0,435.0
1024,1024,1024,64,32,16,16,1898.4,2316.0,1679.0
1024,1024,1024,64,32,16,32,1283.4,1646.0,965.0
1024,1024,1024,64,32,16,64,595.05,634.0,576.0
1024,1024,1024,64,32,16,128,437.25,517.0,423.0
1024,1024,1024,64,32,16,256,425.55,431.0,408.0
1024,1024,1024,64,32,32,16,1612.05,1665.0,1597.0
1024,1024,1024,64,32,32,32,979.25,1218.0,888.0
1024,1024,1024,64,32,32,64,619.15,885.0,530.0
1024,1024,1024,64,32,32,128,353.25,371.0,344.0
1024,1024,1024,64,64,8,16,2008.9,2168.0,1851.0
1024,1024,1024,64,64,8,32,1246.65,1648.0,936.0
1024,1024,1024,64,64,8,64,0.0,0.0,0.0
1024,1024,1024,64,64,8,128,490.7,818.0,452.0
1024,1024,1024,64,64,8,256,444.4,459.0,440.0
1024,1024,1024,64,64,16,16,1982.5,2185.0,1642.0
1024,1024,1024,64,64,16,32,1166.9,1524.0,884.0
1024,1024,1024,64,64,16,64,865.35,1221.0,566.0
1024,1024,1024,64,64,16,128,446.35,588.0,429.0
1024,1024,1024,64,64,16,256,423.9,443.0,410.0
1024,1024,1024,64,64,32,16,1609.6,1644.0,1573.0
1024,1024,1024,64,64,32,32,920.3,966.0,893.0
1024,1024,1024,64,64,32,64,544.3,564.0,528.0
1024,1024,1024,64,64,32,128,411.5,490.0,387.0
1024,1024,1024,64,64,64,16,1986.75,2383.0,1717.0
1024,1024,1024,64,64,64,32,1323.85,1599.0,976.0
1024,1024,1024,64,64,64,64,773.45,1109.0,543.0
1024,1024,1024,64,128,8,16,1979.05,2196.0,1661.0
1024,1024,1024,64,128,8,32,1191.85,1481.0,869.0
1024,1024,1024,64,128,8,64,633.3,1137.0,539.0
1024,1024,1024,64,128,8,128,626.2,793.0,457.0
1024,1024,1024,64,128,8,256,508.6,996.0,457.0
1024,1024,1024,64,128,16,16,1583.1,1605.0,1552.0
1024,1024,1024,64,128,16,32,872.6,884.0,857.0
1024,1024,1024,64,128,16,64,540.6,552.0,527.0
1024,1024,1024,64,128,16,128,425.9,432.0,424.0
1024,1024,1024,64,128,16,256,518.05,1041.0,426.0
1024,1024,1024,64,128,32,16,1669.95,1684.0,1650.0
1024,1024,1024,64,128,32,32,1305.3,1846.0,909.0
1024,1024,1024,64,128,32,64,553.55,830.0,530.0
1024,1024,1024,64,128,32,128,399.8,424.0,385.0
1024,1024,1024,64,128,64,16,1925.5,2249.0,1594.0
1024,1024,1024,64,128,64,32,1190.9,1548.0,885.0
1024,1024,1024,64,128,64,64,579.55,1133.0,515.0
1024,1024,1024,64,128,128,16,1871.6,2117.0,1777.0
1024,1024,1024,64,128,128,32,1205.95,1533.0,867.0
1024,1024,1024,64,256,8,16,1482.4,1807.0,1237.0
1024,1024,1024,64,256,8,32,1122.45,1420.0,732.0
1024,1024,1024,64,256,8,64,544.9,814.0,518.0
1024,1024,1024,64,256,8,128,472.45,510.0,466.0
1024,1024,1024,64,256,8,256,496.1,768.0,473.0
1024,1024,1024,64,256,16,16,1313.3,1578.0,1203.0
1024,1024,1024,64,256,16,32,977.8,1128.0,709.0
1024,1024,1024,64,256,16,64,519.15,777.0,473.0
1024,1024,1024,64,256,16,128,432.9,489.0,425.0
1024,1024,1024,64,256,16,256,432.6,437.0,420.0
1024,1024,1024,64,256,32,16,1226.3,1245.0,1208.0
1024,1024,1024,64,256,32,32,1000.6,1199.0,710.0
1024,1024,1024,64,256,32,64,436.25,440.0,432.0
1024,1024,1024,64,256,32,128,358.75,395.0,342.0
1024,1024,1024,64,256,64,16,1591.85,1836.0,1541.0
1024,1024,1024,64,256,64,32,1009.7,1401.0,716.0
1024,1024,1024,64,256,64,64,421.85,427.0,408.0
1024,1024,1024,64,256,128,16,1568.65,1934.0,1291.0
1024,1024,1024,64,256,128,32,855.35,1364.0,691.0
1024,1024,1024,64,512,8,16,1553.85,1734.0,1479.0
1024,1024,1024,64,512,8,32,776.55,1063.0,731.0
1024,1024,1024,64,512,8,64,534.05,538.0,517.0
1024,1024,1024,64,512,8,128,502.3,809.0,474.0
1024,1024,1024,64,512,8,256,490.65,522.0,470.0
1024,1024,1024,64,512,16,16,1556.5,1853.0,1244.0
1024,1024,1024,64,512,16,32,1017.35,1346.0,716.0
1024,1024,1024,64,512,16,64,508.75,810.0,474.0
1024,1024,1024,64,512,16,128,459.2,719.0,425.0
1024,1024,1024,64,512,16,256,512.75,1024.0,438.0
1024,1024,1024,64,512,32,16,1460.15,1879.0,1220.0
1024,1024,1024,64,512,32,32,0.0,0.0,0.0
1024,1024,1024,64,512,32,64,402.35,407.0,385.0
1024,1024,1024,64,512,32,128,365.35,370.0,348.0
1024,1024,1024,64,512,64,16,1558.75,1758.0,1498.0
1024,1024,1024,64,512,64,32,957.2,1173.0,681.0
1024,1024,1024,64,512,64,64,442.8,708.0,413.0
1024,1024,1024,64,512,128,16,1349.65,1816.0,1270.0
1024,1024,1024,64,512,128,32,1024.35,1270.0,700.0
1024,1024,1024,64,1024,8,16,2067.25,2242.0,1994.0
1024,1024,1024,64,1024,8,32,1491.4,1645.0,1380.0
1024,1024,1024,64,1024,8,64,879.3,1335.0,719.0
1024,1024,1024,64,1024,8,128,831.05,1240.0,610.0
1024,1024,1024,64,1024,8,256,649.45,941.0,605.0
1024,1024,1024,64,1024,16,16,0.0,0.0,0.0
1024,1024,1024,64,1024,16,32,1030.2,1068.0,1009.0
1024,1024,1024,64,1024,16,64,1061.2,1357.0,707.0
1024,1024,1024,64,1024,16,128,746.95,1152.0,586.0
1024,1024,1024,64,1024,16,256,0.0,0.0,0.0
1024,1024,1024,64,1024,32,16,1935.15,2348.0,1675.0
1024,1024,1024,64,1024,32,32,1201.9,1594.0,928.0
1024,1024,1024,64,1024,32,64,799.8,1139.0,596.0
1024,1024,1024,64,1024,32,128,501.65,795.0,471.0
1024,1024,1024,64,1024,64,16,1655.45,1688.0,1647.0
1024,1024,1024,64,1024,64,32,1168.15,1562.0,939.0
1024,1024,1024,64,1024,64,64,643.2,1108.0,547.0
1024,1024,1024,64,1024,128,16,1923.85,2229.0,1604.0
1024,1024,1024,64,1024,128,32,1202.05,1452.0,932.0
1024,1024,1024,128,8,8,16,6181.65,6834.0,5718.0
1024,1024,1024,128,8,8,32,3284.8,3555.0,3006.0
1024,1024,1024,128,8,8,64,2010.05,2138.0,1861.0
1024,1024,1024,128,8,8,128,854.2,873.0,838.0
1024,1024,1024,128,16,8,16,3136.6,3481.0,3007.0
1024,1024,1024,128,16,8,32,1640.35,1676.0,1631.0
1024,1024,1024,128,16,8,64,911.05,967.0,877.0
1024,1024,1024,128,16,8,128,556.6,875.0,517.0
1024,1024,1024,128,16,16,16,2909.9,3275.0,2756.0
1024,1024,1024,128,16,16,32,1617.1,2137.0,1477.0
1024,1024,1024,128,16,16,64,868.95,885.0,851.0
1024,1024,1024,128,16,16,128,515.8,523.0,513.0
1024,1024,1024,128,32,8,16,1759.3,2315.0,1684.0
1024,1024,1024,128,32,8,32,973.45,994.0,966.0
1024,1024,1024,128,32,8,64,886.3,1240.0,579.0
1024,1024,1024,128,32,8,128,455.7,481.0,436.0
1024,1024,1024,128,32,16,16,2037.3,2211.0,1915.0
1024,1024,1024,128,32,16,32,1286.1,1589.0,936.0
1024,1024,1024,128,32,16,64,725.15,1233.0,543.0
1024,1024,1024,128,32,16,128,415.15,440.0,398.0
1024,1024,1024,128,32,32,16,1438.95,1466.0,1420.0
1024,1024,1024,128,32,32,32,989.6,1337.0,816.0
1024,1024,1024,128,32,32,64,510.2,528.0,490.0
1024,1024,1024,128,64,8,16,2015.1,2603.0,1731.0
1024,1024,1024,128,64,8,32,1005.7,1295.0,949.0
1024,1024,1024,128,64,8,64,566.5,598.0,532.0
1024,1024,1024,128,64,8,128,445.45,499.0,437.0
1024,1024,1024,128,64,16,16,1859.95,2120.0,1575.0
1024,1024,1024,128,64,16,32,879.7,885.0,863.0
1024,1024,1024,128,64,16,64,546.85,550.0,543.0
1024,1024,1024,128,64,16,128,408.05,412.0,393.0
1024,1024,1024,128,64,32,16,1400.45,1437.0,1375.0
1024,1024,1024,128,64,32,32,813.2,833.0,805.0
1024,1024,1024,128,64,32,64,497.25,504.0,486.0
1024,1024,1024,128,64,64,16,1409.1,1422.0,1394.0
1024,1024,1024,128,64,64,32,1185.95,1473.0,835.0
1024,1024,1024,128,128,8,16,2004.95,2244.0,1743.0
1024,1024,1024,128,128,8,32,1216.45,1600.0,921.0
1024,1024,1024,128,128,8,64,846.05,1120.0,554.0
1024,1024,1024,128,128,8,128,489.9,645.0,458.0
1024,1024,1024,128,128,16,16,2032.55,2279.0,1925.0
1024,1024,1024,128,128,16,32,961.4,1416.0,877.0
1024,1024,1024,128,128,16,64,545.8,551.0,527.0
1024,1024,1024,128,128,16,128,447.15,631.0,424.0
1024,1024,1024,128,128,32,16,1780.65,2099.0,1565.0
1024,1024,1024,128,128,32,32,1070.95,1438.0,805.0
1024,1024,1024,128,128,32,64,483.9,495.0,464.0
1024,1024,1024,128,128,64,16,1765.35,2149.0,1468.0
1024,1024,1024,128,128,64,32,1024.2,1351.0,803.0
1024,1024,1024,128,256,8,16,1511.4,1804.0,1185.0
1024,1024,1024,128,256,8,32,925.35,1511.0,743.0
1024,1024,1024,128,256,8,64,515.85,524.0,499.0
1024,1024,1024,128,256,8,128,0.0,0.0,0.0
1024,1024,1024,128,256,16,16,1497.3,1754.0,1208.0
1024,1024,1024,128,256,16,32,898.05,1300.0,709.0
1024,1024,1024,128,256,16,64,493.55,528.0,471.0
1024,1024,1024,128,256,16,128,451.05,460.0,438.0
1024,1024,1024,128,256,32,16,1526.95,1783.0,1451.0
1024,1024,1024,128,256,32,32,988.4,1265.0,682.0
1024,1024,1024,128,256,32,64,434.05,497.0,411.0
1024,1024,1024,128,256,64,16,1268.7,1601.0,1109.0
1024,1024,1024,128,256,64,32,896.2,1325.0,651.0
1024,1024,1024,128,512,8,16,1435.4,2074.0,1171.0
1024,1024,1024,128,512,8,32,1107.2,1325.0,777.0
1024,1024,1024,128,512,8,64,699.45,1123.0,539.0
1024,1024,1024,128,512,8,128,652.4,1046.0,534.0
1024,1024,1024,128,512,16,16,0.0,0.0,0.0
1024,1024,1024,128,512,16,32,937.1,1377.0,690.0
1024,1024,1024,128,512,16,64,532.45,825.0,501.0
1024,1024,1024,128,512,16,128,532.9,803.0,504.0
1024,1024,1024,128,512,32,16,1547.1,1798.0,1397.0
1024,1024,1024,128,512,32,32,0.0,0.0,0.0
1024,1024,1024,128,512,32,64,513.9,861.0,405.0
1024,1024,1024,128,512,64,16,1465.95,1760.0,1129.0
1024,1024,1024,128,512,64,32,851.55,1296.0,679.0
1024,1024,1024,128,1024,8,16,1918.3,2342.0,1594.0
1024,1024,1024,128,1024,8,32,1418.75,1630.0,996.0
1024,1024,1024,128,1024,8,64,1019.4,1377.0,698.0
1024,1024,1024,128,1024,8,128,1018.35,1320.0,718.0
1024,1024,1024,128,1024,16,16,1987.4,2389.0,1861.0
1024,1024,1024,128,1024,16,32,1301.55,1596.0,966.0
1024,1024,1024,128,1024,16,64,971.45,1266.0,649.0
1024,1024,1024,128,1024,16,128,757.45,1233.0,661.0
1024,1024,1024,128,1024,32,16,1849.3,2164.0,1558.0
1024,1024,1024,128,1024,32,32,942.65,1443.0,861.0
1024,1024,1024,128,1024,32,64,758.75,1057.0,557.0
1024,1024,1024,128,1024,64,16,1818.95,2111.0,1529.0
1024,1024,1024,128,1024,64,32,1213.85,1571.0,865.0
