programming_examples/matrix_multiplication/bf16/data1.csv
m,k,n,tile_m,tile_k_l2,tile_k_l1,tile_n,runner latency
1024,1024,1024,16,8,8,16,5061.5
1024,1024,1024,16,8,8,32,5348.15
1024,1024,1024,16,8,8,64,2006.45
1024,1024,1024,16,8,8,128,1788.75
1024,1024,1024,16,8,8,256,1516.5
1024,1024,1024,16,16,8,16,3862.3
1024,1024,1024,16,16,8,32,4278.45
1024,1024,1024,16,16,8,64,2028.2
1024,1024,1024,16,16,8,128,1934.75
1024,1024,1024,16,16,8,256,1499.15
1024,1024,1024,16,16,16,16,3913.2
1024,1024,1024,16,16,16,32,2169.9
1024,1024,1024,16,16,16,64,1762.7
1024,1024,1024,16,16,16,128,1651.5
1024,1024,1024,16,16,16,256,1544.7
1024,1024,1024,16,32,8,16,3270.25
1024,1024,1024,16,32,8,32,3398.2
1024,1024,1024,16,32,8,64,2078.95
1024,1024,1024,16,32,8,128,1900.65
1024,1024,1024,16,32,8,256,1766.9
1024,1024,1024,16,32,16,16,3134.1
1024,1024,1024,16,32,16,32,1872.2
1024,1024,1024,16,32,16,64,0.0
1024,1024,1024,16,32,16,128,1557.55
1024,1024,1024,16,32,16,256,1539.85
1024,1024,1024,16,32,32,16,3220.65
1024,1024,1024,16,32,32,32,1836.55
1024,1024,1024,16,32,32,64,1969.5
1024,1024,1024,16,32,32,128,1945.45
1024,1024,1024,16,32,32,256,1975.75
1024,1024,1024,16,64,8,16,3084.9
1024,1024,1024,16,64,8,32,3123.5
1024,1024,1024,16,64,8,64,1743.15
1024,1024,1024,16,64,8,128,1572.7
1024,1024,1024,16,64,8,256,1675.95
1024,1024,1024,16,64,16,16,2835.7
1024,1024,1024,16,64,16,32,1601.85
1024,1024,1024,16,64,16,64,0.0
1024,1024,1024,16,64,16,128,1625.2
1024,1024,1024,16,64,16,256,1281.15
1024,1024,1024,16,64,32,16,2873.3
1024,1024,1024,16,64,32,32,1808.1
1024,1024,1024,16,64,32,64,1934.5
1024,1024,1024,16,64,32,128,1888.65
1024,1024,1024,16,64,32,256,1971.6
1024,1024,1024,16,64,64,16,0.0
1024,1024,1024,16,64,64,32,2078.95
1024,1024,1024,16,64,64,64,1996.65
1024,1024,1024,16,64,64,128,1899.5
1024,1024,1024,16,128,8,16,2791.55
1024,1024,1024,16,128,8,32,2781.65
1024,1024,1024,16,128,8,64,1768.9
1024,1024,1024,16,128,8,128,1570.6
1024,1024,1024,16,128,8,256,1569.65
1024,1024,1024,16,128,16,16,2786.85
1024,1024,1024,16,128,16,32,1639.8
1024,1024,1024,16,128,16,64,1435.45
1024,1024,1024,16,128,16,128,1310.25
1024,1024,1024,16,128,16,256,1272.2
1024,1024,1024,16,128,32,16,3152.05
1024,1024,1024,16,128,32,32,2123.05
1024,1024,1024,16,128,32,64,1848.6
1024,1024,1024,16,128,32,128,1879.7
1024,1024,1024,16,128,32,256,1772.6
1024,1024,1024,16,128,64,16,2701.9
1024,1024,1024,16,128,64,32,1792.9
1024,1024,1024,16,128,64,64,1965.1
1024,1024,1024,16,128,64,128,0.0
1024,1024,1024,16,128,128,16,2994.35
1024,1024,1024,16,128,128,32,2017.45
1024,1024,1024,16,128,128,64,1971.05
1024,1024,1024,16,256,8,16,2975.7
1024,1024,1024,16,256,8,32,3067.5
1024,1024,1024,16,256,8,64,2108.35
1024,1024,1024,16,256,8,128,1937.2
1024,1024,1024,16,256,8,256,1722.55
1024,1024,1024,16,256,16,16,2699.55
1024,1024,1024,16,256,16,32,2046.35
1024,1024,1024,16,256,16,64,1808.3
1024,1024,1024,16,256,16,128,0.0
1024,1024,1024,16,256,16,256,1616.25
1024,1024,1024,16,256,32,16,2969.8
1024,1024,1024,16,256,32,32,2076.6
1024,1024,1024,16,256,32,64,1652.05
1024,1024,1024,16,256,32,128,1537.5
1024,1024,1024,16,256,32,256,1904.45
1024,1024,1024,16,256,64,16,3031.7
1024,1024,1024,16,256,64,32,2121.5
1024,1024,1024,16,256,64,64,1985.7
1024,1024,1024,16,256,64,128,1846.05
1024,1024,1024,16,256,128,16,2899.95
1024,1024,1024,16,256,128,32,2084.6
1024,1024,1024,16,256,128,64,1903.1
1024,1024,1024,16,256,256,16,2954.1
1024,1024,1024,16,256,256,32,2037.7
1024,1024,1024,16,512,8,16,3076.05
1024,1024,1024,16,512,8,32,3146.4
1024,1024,1024,16,512,8,64,2144.3
1024,1024,1024,16,512,8,128,1982.75
1024,1024,1024,16,512,8,256,1797.55
1024,1024,1024,16,512,16,16,3089.25
1024,1024,1024,16,512,16,32,1954.95
1024,1024,1024,16,512,16,64,1714.15
1024,1024,1024,16,512,16,128,1590.45
1024,1024,1024,16,512,16,256,1673.75
1024,1024,1024,16,512,32,16,3083.85
1024,1024,1024,16,512,32,32,2105.95
1024,1024,1024,16,512,32,64,2073.05
1024,1024,1024,16,512,32,128,1897.75
1024,1024,1024,16,512,32,256,1993.75
1024,1024,1024,16,512,64,16,2738.2
1024,1024,1024,16,512,64,32,0.0
1024,1024,1024,16,512,64,64,1988.1
1024,1024,1024,16,512,64,128,1910.7
1024,1024,1024,16,512,128,16,2810.4
1024,1024,1024,16,512,128,32,2153.05
1024,1024,1024,16,512,128,64,1970.1
1024,1024,1024,16,512,256,16,2983.55
1024,1024,1024,16,512,256,32,1956.7
1024,1024,1024,16,1024,8,16,6105.25
1024,1024,1024,16,1024,8,32,4740.85
1024,1024,1024,16,1024,8,64,2462.9
1024,1024,1024,16,1024,8,128,2096.5
1024,1024,1024,16,1024,8,256,2553.65
1024,1024,1024,16,1024,16,16,4027.8
1024,1024,1024,16,1024,16,32,2972.65
1024,1024,1024,16,1024,16,64,2146.85
1024,1024,1024,16,1024,16,128,1922.55
1024,1024,1024,16,1024,16,256,1676.75
1024,1024,1024,16,1024,32,16,4166.2
1024,1024,1024,16,1024,32,32,3066.55
1024,1024,1024,16,1024,32,64,2249.15
1024,1024,1024,16,1024,32,128,2146.65
1024,1024,1024,16,1024,32,256,2341.25
1024,1024,1024,16,1024,64,16,3682.3
1024,1024,1024,16,1024,64,32,2592.7
1024,1024,1024,16,1024,64,64,2211.7
1024,1024,1024,16,1024,64,128,2136.4
1024,1024,1024,16,1024,128,16,3660.65
1024,1024,1024,16,1024,128,32,2457.85
1024,1024,1024,16,1024,128,64,2051.3
1024,1024,1024,16,1024,256,16,4034.4
1024,1024,1024,16,1024,256,32,2528.35
1024,1024,1024,32,8,8,16,5176.75
1024,1024,1024,32,8,8,32,5169.05
1024,1024,1024,32,8,8,64,1924.35
1024,1024,1024,32,8,8,128,1676.05
1024,1024,1024,32,8,8,256,1599.15
1024,1024,1024,32,16,8,16,3416.95
1024,1024,1024,32,16,8,32,3327.1
1024,1024,1024,32,16,8,64,1516.05
1024,1024,1024,32,16,8,128,1545.35
1024,1024,1024,32,16,8,256,1533.95
1024,1024,1024,32,16,16,16,3167.75
1024,1024,1024,32,16,16,32,2060.05
1024,1024,1024,32,16,16,64,1742.8
1024,1024,1024,32,16,16,128,0.0
1024,1024,1024,32,16,16,256,1412.85
1024,1024,1024,32,32,8,16,2548.25
1024,1024,1024,32,32,8,32,2606.85
1024,1024,1024,32,32,8,64,1748.25
1024,1024,1024,32,32,8,128,1584.25
1024,1024,1024,32,32,8,256,1457.5
1024,1024,1024,32,32,16,16,2451.7
1024,1024,1024,32,32,16,32,1858.9
1024,1024,1024,32,32,16,64,1736.6
1024,1024,1024,32,32,16,128,1300.25
1024,1024,1024,32,32,16,256,1236.5
1024,1024,1024,32,32,32,16,2122.55
1024,1024,1024,32,32,32,32,1721.4
1024,1024,1024,32,32,32,64,1740.15
1024,1024,1024,32,32,32,128,1825.6
1024,1024,1024,32,32,32,256,1879.75
1024,1024,1024,32,64,8,16,2583.5
1024,1024,1024,32,64,8,32,2587.5
1024,1024,1024,32,64,8,64,0.0
1024,1024,1024,32,64,8,128,1550.25
1024,1024,1024,32,64,8,256,1264.15
1024,1024,1024,32,64,16,16,2405.35
1024,1024,1024,32,64,16,32,1747.45
1024,1024,1024,32,64,16,64,1387.8
1024,1024,1024,32,64,16,128,1592.15
1024,1024,1024,32,64,16,256,1499.6
1024,1024,1024,32,64,32,16,2394.9
1024,1024,1024,32,64,32,32,1945.8
1024,1024,1024,32,64,32,64,1799.75
1024,1024,1024,32,64,32,128,1755.05
1024,1024,1024,32,64,32,256,1878.6
1024,1024,1024,32,64,64,16,2444.55
1024,1024,1024,32,64,64,32,2007.85
1024,1024,1024,32,64,64,64,1808.55
1024,1024,1024,32,64,64,128,1463.05
1024,1024,1024,32,128,8,16,2623.95
1024,1024,1024,32,128,8,32,2555.9
1024,1024,1024,32,128,8,64,1871.8
1024,1024,1024,32,128,8,128,0.0
1024,1024,1024,32,128,8,256,1585.1
1024,1024,1024,32,128,16,16,2345.55
1024,1024,1024,32,128,16,32,1855.95
1024,1024,1024,32,128,16,64,1401.1
1024,1024,1024,32,128,16,128,1663.55
1024,1024,1024,32,128,16,256,1545.4
1024,1024,1024,32,128,32,16,2262.45
1024,1024,1024,32,128,32,32,2069.2
1024,1024,1024,32,128,32,64,1563.45
1024,1024,1024,32,128,32,128,1828.4
1024,1024,1024,32,128,32,256,1697.7
1024,1024,1024,32,128,64,16,2258.3
1024,1024,1024,32,128,64,32,1697.35
1024,1024,1024,32,128,64,64,1920.9
1024,1024,1024,32,128,64,128,1846.5
1024,1024,1024,32,128,128,16,2296.95
1024,1024,1024,32,128,128,32,1585.5
1024,1024,1024,32,128,128,64,1528.85
1024,1024,1024,32,256,8,16,2530.3
1024,1024,1024,32,256,8,32,2657.7
1024,1024,1024,32,256,8,64,1547.95
1024,1024,1024,32,256,8,128,1402.2
1024,1024,1024,32,256,8,256,1303.2
1024,1024,1024,32,256,16,16,0.0
1024,1024,1024,32,256,16,32,1640.3
1024,1024,1024,32,256,16,64,1775.95
1024,1024,1024,32,256,16,128,1608.55
1024,1024,1024,32,256,16,256,1235.5
1024,1024,1024,32,256,32,16,2183.45
1024,1024,1024,32,256,32,32,1952.85
1024,1024,1024,32,256,32,64,1916.65
1024,1024,1024,32,256,32,128,0.0
1024,1024,1024,32,256,32,256,1962.9
1024,1024,1024,32,256,64,16,2141.9
1024,1024,1024,32,256,64,32,1827.3
1024,1024,1024,32,256,64,64,0.0
1024,1024,1024,32,256,64,128,1726.25
1024,1024,1024,32,256,128,16,2054.35
1024,1024,1024,32,256,128,32,2007.1
1024,1024,1024,32,256,128,64,1784.6
1024,1024,1024,32,256,256,16,2125.8
1024,1024,1024,32,512,8,16,2717.95
1024,1024,1024,32,512,8,32,2729.95
1024,1024,1024,32,512,8,64,1880.8
1024,1024,1024,32,512,8,128,1560.1
1024,1024,1024,32,512,8,256,1507.05
1024,1024,1024,32,512,16,16,2143.25
1024,1024,1024,32,512,16,32,2022.05
1024,1024,1024,32,512,16,64,1687.8
1024,1024,1024,32,512,16,128,1326.95
1024,1024,1024,32,512,16,256,1310.45
1024,1024,1024,32,512,32,16,1978.85
1024,1024,1024,32,512,32,32,2078.35
1024,1024,1024,32,512,32,64,1750.15
1024,1024,1024,32,512,32,128,1784.35
1024,1024,1024,32,512,32,256,1528.65
1024,1024,1024,32,512,64,16,2294.35
1024,1024,1024,32,512,64,32,1719.35
1024,1024,1024,32,512,64,64,1576.3
1024,1024,1024,32,512,64,128,1824.7
1024,1024,1024,32,512,128,16,2044.4
1024,1024,1024,32,512,128,32,1987.95
1024,1024,1024,32,512,128,64,1913.8
1024,1024,1024,32,512,256,16,2244.85
1024,1024,1024,32,1024,8,16,3712.15
1024,1024,1024,32,1024,8,32,3615.2
1024,1024,1024,32,1024,8,64,2287.2
1024,1024,1024,32,1024,8,128,1857.05
1024,1024,1024,32,1024,8,256,1911.1
1024,1024,1024,32,1024,16,16,3202.05
1024,1024,1024,32,1024,16,32,2168.85
1024,1024,1024,32,1024,16,64,1961.95
1024,1024,1024,32,1024,16,128,1786.35
1024,1024,1024,32,1024,16,256,1519.6
1024,1024,1024,32,1024,32,16,3044.5
1024,1024,1024,32,1024,32,32,2554.15
1024,1024,1024,32,1024,32,64,2200.85
1024,1024,1024,32,1024,32,128,2008.1
1024,1024,1024,32,1024,32,256,1964.55
1024,1024,1024,32,1024,64,16,2765.2
1024,1024,1024,32,1024,64,32,2083.55
1024,1024,1024,32,1024,64,64,2051.55
1024,1024,1024,32,1024,64,128,2001.9
1024,1024,1024,32,1024,128,16,2930.05
1024,1024,1024,32,1024,128,32,1976.25
1024,1024,1024,32,1024,128,64,1991.8
1024,1024,1024,32,1024,256,16,2736.05
1024,1024,1024,64,8,8,16,5686.4
1024,1024,1024,64,8,8,32,5656.5
1024,1024,1024,64,8,8,64,1551.8
1024,1024,1024,64,8,8,128,1577.7
1024,1024,1024,64,8,8,256,1616.35
1024,1024,1024,64,16,8,16,3172.6
1024,1024,1024,64,16,8,32,3222.55
1024,1024,1024,64,16,8,64,1771.5
1024,1024,1024,64,16,8,128,1588.3
1024,1024,1024,64,16,8,256,0.0
1024,1024,1024,64,16,16,16,3458.05
1024,1024,1024,64,16,16,32,1987.6
1024,1024,1024,64,16,16,64,1533.65
1024,1024,1024,64,16,16,128,1608.65
1024,1024,1024,64,16,16,256,1519.45
1024,1024,1024,64,32,8,16,2149.2
1024,1024,1024,64,32,8,32,2097.35
1024,1024,1024,64,32,8,64,1783.3
1024,1024,1024,64,32,8,128,1363.8
1024,1024,1024,64,32,8,256,1538.35
1024,1024,1024,64,32,16,16,3506.35
1024,1024,1024,64,32,16,32,1899.95
1024,1024,1024,64,32,16,64,1555.5
1024,1024,1024,64,32,16,128,1339.25
1024,1024,1024,64,32,16,256,0.0
1024,1024,1024,64,32,32,16,2143.15
1024,1024,1024,64,32,32,32,0.0
1024,1024,1024,64,32,32,64,1838.15
1024,1024,1024,64,32,32,128,1885.7
1024,1024,1024,64,64,8,16,2176.55
1024,1024,1024,64,64,8,32,2110.3
1024,1024,1024,64,64,8,64,1811.9
1024,1024,1024,64,64,8,128,1530.65
1024,1024,1024,64,64,8,256,1515.45
1024,1024,1024,64,64,16,16,3579.35
1024,1024,1024,64,64,16,32,1458.35
1024,1024,1024,64,64,16,64,1338.15
1024,1024,1024,64,64,16,128,1232.95
1024,1024,1024,64,64,16,256,1470.6
1024,1024,1024,64,64,32,16,2117.65
1024,1024,1024,64,64,32,32,1916.9
1024,1024,1024,64,64,32,64,1783.4
1024,1024,1024,64,64,32,128,1912.8
1024,1024,1024,64,64,64,16,1841.35
1024,1024,1024,64,64,64,32,1603.7
1024,1024,1024,64,64,64,64,1588.7
1024,1024,1024,64,128,8,16,1674.65
1024,1024,1024,64,128,8,32,2107.55
1024,1024,1024,64,128,8,64,1785.65
1024,1024,1024,64,128,8,128,1288.3
1024,1024,1024,64,128,8,256,1560.8
1024,1024,1024,64,128,16,16,3278.05
1024,1024,1024,64,128,16,32,1746.95
1024,1024,1024,64,128,16,64,1345.05
1024,1024,1024,64,128,16,128,1446.7
1024,1024,1024,64,128,16,256,1536.65
1024,1024,1024,64,128,32,16,2195.75
1024,1024,1024,64,128,32,32,1900.55
1024,1024,1024,64,128,32,64,1937.05
1024,1024,1024,64,128,32,128,0.0
1024,1024,1024,64,128,64,16,2073.75
1024,1024,1024,64,128,64,32,1885.3
1024,1024,1024,64,128,64,64,1850.55
1024,1024,1024,64,128,128,16,1830.15
1024,1024,1024,64,128,128,32,1880.3
1024,1024,1024,64,256,8,16,1990.8
1024,1024,1024,64,256,8,32,2016.05
1024,1024,1024,64,256,8,64,1702.95
1024,1024,1024,64,256,8,128,1558.1
1024,1024,1024,64,256,8,256,1320.35
1024,1024,1024,64,256,16,16,3681.25
1024,1024,1024,64,256,16,32,1465.2
1024,1024,1024,64,256,16,64,1677.15
1024,1024,1024,64,256,16,128,1534.8
1024,1024,1024,64,256,16,256,0.0
1024,1024,1024,64,256,32,16,2087.65
1024,1024,1024,64,256,32,32,1635.55
1024,1024,1024,64,256,32,64,0.0
1024,1024,1024,64,256,32,128,1499.95
1024,1024,1024,64,256,64,16,0.0
1024,1024,1024,64,256,64,32,1602.3
1024,1024,1024,64,256,64,64,1957.1
1024,1024,1024,64,256,128,16,2174.6
1024,1024,1024,64,256,128,32,1844.3
1024,1024,1024,64,512,8,16,2093.75
1024,1024,1024,64,512,8,32,2007.8
1024,1024,1024,64,512,8,64,1788.75
1024,1024,1024,64,512,8,128,1474.8
1024,1024,1024,64,512,8,256,1644.25
1024,1024,1024,64,512,16,16,3763.85
1024,1024,1024,64,512,16,32,1519.05
1024,1024,1024,64,512,16,64,1710.85
1024,1024,1024,64,512,16,128,1548.05
1024,1024,1024,64,512,16,256,1547.2
1024,1024,1024,64,512,32,16,2269.95
1024,1024,1024,64,512,32,32,2024.5
1024,1024,1024,64,512,32,64,1818.7
1024,1024,1024,64,512,32,128,1785.7
1024,1024,1024,64,512,64,16,1900.65
1024,1024,1024,64,512,64,32,1641.1
1024,1024,1024,64,512,64,64,1897.85
1024,1024,1024,64,512,128,16,2219.25
1024,1024,1024,64,512,128,32,1626.95
1024,1024,1024,64,1024,8,16,2770.1
1024,1024,1024,64,1024,8,32,2745.05
1024,1024,1024,64,1024,8,64,2014.1
1024,1024,1024,64,1024,8,128,1725.25
1024,1024,1024,64,1024,8,256,1795.75
1024,1024,1024,64,1024,16,16,4550.65
1024,1024,1024,64,1024,16,32,2161.5
1024,1024,1024,64,1024,16,64,1967.15
1024,1024,1024,64,1024,16,128,1505.7
1024,1024,1024,64,1024,16,256,1769.5
1024,1024,1024,64,1024,32,16,2834.5
1024,1024,1024,64,1024,32,32,2363.45
1024,1024,1024,64,1024,32,64,2075.6
1024,1024,1024,64,1024,32,128,2005.4
1024,1024,1024,64,1024,64,16,2492.1
1024,1024,1024,64,1024,64,32,1986.45
1024,1024,1024,64,1024,64,64,2029.1
1024,1024,1024,64,1024,128,16,2686.8
1024,1024,1024,64,1024,128,32,2239.45
1024,1024,1024,128,8,8,16,5850.2
1024,1024,1024,128,8,8,32,0.0
1024,1024,1024,128,8,8,64,1635.15
1024,1024,1024,128,8,8,128,1317.15
1024,1024,1024,128,16,8,16,3324.7
1024,1024,1024,128,16,8,32,3380.75
1024,1024,1024,128,16,8,64,1611.2
1024,1024,1024,128,16,8,128,1636.5
1024,1024,1024,128,16,16,16,3519.95
1024,1024,1024,128,16,16,32,2014.15
1024,1024,1024,128,16,16,64,1606.7
1024,1024,1024,128,16,16,128,1254.1
1024,1024,1024,128,32,8,16,1811.45
1024,1024,1024,128,32,8,32,2243.3
1024,1024,1024,128,32,8,64,1734.15
1024,1024,1024,128,32,8,128,1594.8
1024,1024,1024,128,32,16,16,3243.65
1024,1024,1024,128,32,16,32,1448.75
1024,1024,1024,128,32,16,64,1320.25
1024,1024,1024,128,32,16,128,1603.65
1024,1024,1024,128,32,32,16,2211.65
1024,1024,1024,128,32,32,32,1884.2
1024,1024,1024,128,32,32,64,1732.95
1024,1024,1024,128,64,8,16,1886.35
1024,1024,1024,128,64,8,32,2109.45
1024,1024,1024,128,64,8,64,1612.45
1024,1024,1024,128,64,8,128,1588.55
1024,1024,1024,128,64,16,16,3504.55
1024,1024,1024,128,64,16,32,1663.7
1024,1024,1024,128,64,16,64,1521.8
1024,1024,1024,128,64,16,128,1594.6
1024,1024,1024,128,64,32,16,1981.65
1024,1024,1024,128,64,32,32,1997.95
1024,1024,1024,128,64,32,64,1869.15
1024,1024,1024,128,64,64,16,1974.35
1024,1024,1024,128,64,64,32,1611.3
1024,1024,1024,128,128,8,16,2135.55
1024,1024,1024,128,128,8,32,2057.8
1024,1024,1024,128,128,8,64,1394.7
1024,1024,1024,128,128,8,128,1314.15
1024,1024,1024,128,128,16,16,3653.25
1024,1024,1024,128,128,16,32,1695.05
1024,1024,1024,128,128,16,64,0.0
1024,1024,1024,128,128,16,128,1514.3
1024,1024,1024,128,128,32,16,2176.45
1024,1024,1024,128,128,32,32,2020.1
1024,1024,1024,128,128,32,64,1908.3
1024,1024,1024,128,128,64,16,2108.35
1024,1024,1024,128,128,64,32,1945.7
1024,1024,1024,128,256,8,16,2014.35
1024,1024,1024,128,256,8,32,1935.25
1024,1024,1024,128,256,8,64,1717.15
1024,1024,1024,128,256,8,128,1536.2
1024,1024,1024,128,256,16,16,3631.15
1024,1024,1024,128,256,16,32,1925.25
1024,1024,1024,128,256,16,64,1435.65
1024,1024,1024,128,256,16,128,1426.15
1024,1024,1024,128,256,32,16,2099.95
1024,1024,1024,128,256,32,32,2015.45
1024,1024,1024,128,256,32,64,1752.05
1024,1024,1024,128,256,64,16,2215.15
1024,1024,1024,128,256,64,32,1989.95
1024,1024,1024,128,512,8,16,2085.7
1024,1024,1024,128,512,8,32,2118.1
1024,1024,1024,128,512,8,64,1737.05
1024,1024,1024,128,512,8,128,1730.9
1024,1024,1024,128,512,16,16,3931.65
1024,1024,1024,128,512,16,32,0.0
1024,1024,1024,128,512,16,64,1716.45
1024,1024,1024,128,512,16,128,1719.55
1024,1024,1024,128,512,32,16,2042.1
1024,1024,1024,128,512,32,32,2006.65
1024,1024,1024,128,512,32,64,1933.4
1024,1024,1024,128,512,64,16,2309.15
1024,1024,1024,128,512,64,32,1916.3
1024,1024,1024,128,1024,8,16,2610.7
1024,1024,1024,128,1024,8,32,2828.35
1024,1024,1024,128,1024,8,64,0.0
1024,1024,1024,128,1024,8,128,1935.7
1024,1024,1024,128,1024,16,16,4076.7
1024,1024,1024,128,1024,16,32,2147.7
1024,1024,1024,128,1024,16,64,1891.5
1024,1024,1024,128,1024,16,128,1800.75
1024,1024,1024,128,1024,32,16,2601.55
1024,1024,1024,128,1024,32,32,2324.45
1024,1024,1024,128,1024,32,64,2015.7
1024,1024,1024,128,1024,64,16,2694.35
1024,1024,1024,128,1024,64,32,2102.55
