programming_examples/matrix_multiplication/bf16/data1.csv
m,k,n,tile_m,tile_k_l2,tile_k_l1,tile_n,latency avg,latency max,latency min
1024,1024,1024,16,8,8,16,5703.55,5818.0,5407.0
1024,1024,1024,16,8,8,32,6728.5,7227.0,6316.0
1024,1024,1024,16,8,8,64,6522.6,7276.0,5887.0
1024,1024,1024,16,8,8,128,5895.7,6292.0,5568.0
1024,1024,1024,16,8,8,256,0.0,0.0,0.0
1024,1024,1024,16,16,8,16,5669.2,6073.0,5401.0
1024,1024,1024,16,16,8,32,6948.45,7513.0,6372.0
1024,1024,1024,16,16,8,64,6269.5,6682.0,5780.0
1024,1024,1024,16,16,8,128,5958.1,6298.0,5684.0
1024,1024,1024,16,16,8,256,5497.35,5878.0,5353.0
1024,1024,1024,16,16,16,16,0.0,0.0,0.0
1024,1024,1024,16,16,16,32,5109.85,5827.0,4797.0
1024,1024,1024,16,16,16,64,4420.55,4774.0,4351.0
1024,1024,1024,16,16,16,128,4488.5,4665.0,4203.0
1024,1024,1024,16,16,16,256,4398.85,5030.0,4129.0
1024,1024,1024,16,32,8,16,0.0,0.0,0.0
1024,1024,1024,16,32,8,32,6838.75,7483.0,6389.0
1024,1024,1024,16,32,8,64,0.0,0.0,0.0
1024,1024,1024,16,32,8,128,6117.2,6415.0,5777.0
1024,1024,1024,16,32,8,256,5713.25,6058.0,5413.0
1024,1024,1024,16,32,16,16,4192.95,4517.0,3914.0
1024,1024,1024,16,32,16,32,6158.05,6552.0,5580.0
1024,1024,1024,16,32,16,64,4777.9,5643.0,4375.0
1024,1024,1024,16,32,16,128,4666.5,5707.0,4272.0
1024,1024,1024,16,32,16,256,4523.95,4694.0,4235.0
1024,1024,1024,16,32,32,16,7012.95,7300.0,6726.0
1024,1024,1024,16,32,32,32,7108.95,7401.0,6661.0
1024,1024,1024,16,32,32,64,6617.5,7335.0,6414.0
1024,1024,1024,16,32,32,128,6381.45,6696.0,6047.0
1024,1024,1024,16,32,32,256,6370.85,6577.0,6083.0
1024,1024,1024,16,64,8,16,6112.9,7471.0,5433.0
1024,1024,1024,16,64,8,32,7421.3,7919.0,6627.0
1024,1024,1024,16,64,8,64,7129.5,7729.0,6302.0
1024,1024,1024,16,64,8,128,5850.35,6466.0,5497.0
1024,1024,1024,16,64,8,256,5628.7,5909.0,5386.0
1024,1024,1024,16,64,16,16,5492.55,5923.0,3986.0
1024,1024,1024,16,64,16,32,5418.45,6378.0,4934.0
1024,1024,1024,16,64,16,64,0.0,0.0,0.0
1024,1024,1024,16,64,16,128,4568.15,4874.0,4209.0
1024,1024,1024,16,64,16,256,4463.25,4741.0,4155.0
1024,1024,1024,16,64,32,16,7910.05,8233.0,7570.0
1024,1024,1024,16,64,32,32,7022.55,7476.0,6460.0
1024,1024,1024,16,64,32,64,6562.9,6973.0,6175.0
1024,1024,1024,16,64,32,128,6345.4,6575.0,6040.0
1024,1024,1024,16,64,32,256,0.0,0.0,0.0
1024,1024,1024,16,64,64,16,7092.05,7916.0,6661.0
1024,1024,1024,16,64,64,32,6623.85,7168.0,6355.0
1024,1024,1024,16,64,64,64,6601.4,7036.0,6202.0
1024,1024,1024,16,64,64,128,6475.55,6926.0,6151.0
1024,1024,1024,16,128,8,16,6400.95,8078.0,5448.0
1024,1024,1024,16,128,8,32,6728.15,7876.0,6322.0
1024,1024,1024,16,128,8,64,6247.6,6595.0,5934.0
1024,1024,1024,16,128,8,128,0.0,0.0,0.0
1024,1024,1024,16,128,8,256,5512.95,5602.0,5440.0
1024,1024,1024,16,128,16,16,5505.45,6539.0,4211.0
1024,1024,1024,16,128,16,32,5594.55,7152.0,4794.0
1024,1024,1024,16,128,16,64,4640.15,5585.0,4344.0
1024,1024,1024,16,128,16,128,4377.15,5006.0,4153.0
1024,1024,1024,16,128,16,256,4495.1,4726.0,4232.0
1024,1024,1024,16,128,32,16,0.0,0.0,0.0
1024,1024,1024,16,128,32,32,7332.95,7707.0,6891.0
1024,1024,1024,16,128,32,64,6549.3,7090.0,6142.0
1024,1024,1024,16,128,32,128,6276.7,6778.0,6047.0
1024,1024,1024,16,128,32,256,6246.15,6471.0,6137.0
1024,1024,1024,16,128,64,16,7320.4,8222.0,6667.0
1024,1024,1024,16,128,64,32,6628.5,6790.0,6369.0
1024,1024,1024,16,128,64,64,6714.5,6938.0,6349.0
1024,1024,1024,16,128,64,128,6468.45,6742.0,6207.0
1024,1024,1024,16,128,128,16,7454.65,8059.0,6924.0
1024,1024,1024,16,128,128,32,0.0,0.0,0.0
1024,1024,1024,16,128,128,64,6723.4,6871.0,6270.0
1024,1024,1024,16,256,8,16,5780.7,5949.0,5504.0
1024,1024,1024,16,256,8,32,6657.75,6836.0,6388.0
1024,1024,1024,16,256,8,64,6137.7,6611.0,5835.0
1024,1024,1024,16,256,8,128,5840.4,6616.0,5450.0
1024,1024,1024,16,256,8,256,5530.15,5641.0,5468.0
1024,1024,1024,16,256,16,16,3939.1,3963.0,3932.0
1024,1024,1024,16,256,16,32,5423.75,6186.0,4866.0
1024,1024,1024,16,256,16,64,0.0,0.0,0.0
1024,1024,1024,16,256,16,128,4607.4,4943.0,4341.0
1024,1024,1024,16,256,16,256,4569.35,5038.0,4195.0
1024,1024,1024,16,256,32,16,7465.45,8873.0,7095.0
1024,1024,1024,16,256,32,32,7037.2,7775.0,6659.0
1024,1024,1024,16,256,32,64,6674.65,7091.0,6401.0
1024,1024,1024,16,256,32,128,6326.55,6906.0,6117.0
1024,1024,1024,16,256,32,256,6157.3,6368.0,6091.0
1024,1024,1024,16,256,64,16,7683.85,8628.0,6741.0
1024,1024,1024,16,256,64,32,0.0,0.0,0.0
1024,1024,1024,16,256,64,64,6519.55,6804.0,6425.0
1024,1024,1024,16,256,64,128,6340.75,6514.0,6193.0
1024,1024,1024,16,256,128,16,7318.5,7720.0,6715.0
1024,1024,1024,16,256,128,32,6937.05,7412.0,6498.0
1024,1024,1024,16,256,128,64,6515.35,6759.0,6309.0
1024,1024,1024,16,256,256,16,7613.45,8143.0,6987.0
1024,1024,1024,16,256,256,32,6793.75,7253.0,6422.0
1024,1024,1024,16,512,8,16,6853.05,7301.0,5627.0
1024,1024,1024,16,512,8,32,0.0,0.0,0.0
1024,1024,1024,16,512,8,64,6277.25,6550.0,6063.0
1024,1024,1024,16,512,8,128,5897.5,6171.0,5593.0
1024,1024,1024,16,512,8,256,5746.4,6006.0,5515.0
1024,1024,1024,16,512,16,16,4587.4,5842.0,4096.0
1024,1024,1024,16,512,16,32,5648.6,5936.0,5206.0
1024,1024,1024,16,512,16,64,4787.35,5415.0,4421.0
1024,1024,1024,16,512,16,128,4526.7,4823.0,4247.0
1024,1024,1024,16,512,16,256,4580.3,4862.0,4522.0
1024,1024,1024,16,512,32,16,7057.8,7913.0,6924.0
1024,1024,1024,16,512,32,32,6596.8,7004.0,6449.0
1024,1024,1024,16,512,32,64,6193.8,6223.0,6171.0
1024,1024,1024,16,512,32,128,6474.4,6691.0,6212.0
1024,1024,1024,16,512,32,256,6495.25,6839.0,6212.0
1024,1024,1024,16,512,64,16,7398.6,7968.0,6814.0
1024,1024,1024,16,512,64,32,6992.85,7393.0,6681.0
1024,1024,1024,16,512,64,64,6642.75,6947.0,6308.0
1024,1024,1024,16,512,64,128,6553.35,6825.0,6258.0
1024,1024,1024,16,512,128,16,7845.65,8120.0,7450.0
1024,1024,1024,16,512,128,32,7243.15,7598.0,7029.0
1024,1024,1024,16,512,128,64,6585.05,6978.0,6284.0
1024,1024,1024,16,512,256,16,7632.2,7883.0,6963.0
1024,1024,1024,16,512,256,32,7112.75,7381.0,6971.0
1024,1024,1024,16,1024,8,16,8903.25,9836.0,6955.0
1024,1024,1024,16,1024,8,32,8456.3,8762.0,7839.0
1024,1024,1024,16,1024,8,64,6359.7,6845.0,6186.0
1024,1024,1024,16,1024,8,128,6011.3,6286.0,5775.0
1024,1024,1024,16,1024,8,256,6416.35,6757.0,6060.0
1024,1024,1024,16,1024,16,16,6672.2,7882.0,5443.0
1024,1024,1024,16,1024,16,32,6155.65,7221.0,5731.0
1024,1024,1024,16,1024,16,64,5739.7,5949.0,5142.0
1024,1024,1024,16,1024,16,128,4620.8,4888.0,4494.0
1024,1024,1024,16,1024,16,256,5016.4,5475.0,4806.0
1024,1024,1024,16,1024,32,16,10064.2,10557.0,8382.0
1024,1024,1024,16,1024,32,32,8626.85,9048.0,8106.0
1024,1024,1024,16,1024,32,64,7041.8,7149.0,6846.0
1024,1024,1024,16,1024,32,128,6491.6,7096.0,6188.0
1024,1024,1024,16,1024,32,256,0.0,0.0,0.0
1024,1024,1024,16,1024,64,16,8847.05,10920.0,7785.0
1024,1024,1024,16,1024,64,32,7235.3,8553.0,6792.0
1024,1024,1024,16,1024,64,64,7039.85,7371.0,6790.0
1024,1024,1024,16,1024,64,128,6347.4,6771.0,6194.0
1024,1024,1024,16,1024,128,16,8847.1,9557.0,7333.0
1024,1024,1024,16,1024,128,32,7516.9,7993.0,6576.0
1024,1024,1024,16,1024,128,64,6821.8,7078.0,6509.0
1024,1024,1024,16,1024,256,16,8478.3,8829.0,7922.0
1024,1024,1024,16,1024,256,32,7077.25,7215.0,6776.0
1024,1024,1024,32,8,8,16,5871.6,6469.0,5524.0
1024,1024,1024,32,8,8,32,6334.5,6654.0,6109.0
1024,1024,1024,32,8,8,64,6039.45,6345.0,5718.0
1024,1024,1024,32,8,8,128,5871.4,6442.0,5519.0
1024,1024,1024,32,8,8,256,5861.6,6551.0,5481.0
1024,1024,1024,32,16,8,16,5068.75,5738.0,4899.0
1024,1024,1024,32,16,8,32,6397.7,6684.0,6084.0
1024,1024,1024,32,16,8,64,5812.2,6325.0,5668.0
1024,1024,1024,32,16,8,128,5792.35,6042.0,5514.0
1024,1024,1024,32,16,8,256,5804.1,6087.0,5469.0
1024,1024,1024,32,16,16,16,4035.5,4580.0,3759.0
1024,1024,1024,32,16,16,32,4645.3,5208.0,4551.0
1024,1024,1024,32,16,16,64,4464.9,4760.0,4306.0
1024,1024,1024,32,16,16,128,4440.55,4970.0,4169.0
1024,1024,1024,32,16,16,256,4372.4,4713.0,4095.0
1024,1024,1024,32,32,8,16,5347.65,5889.0,4895.0
1024,1024,1024,32,32,8,32,6046.65,6316.0,5894.0
1024,1024,1024,32,32,8,64,5847.65,6364.0,5700.0
1024,1024,1024,32,32,8,128,5704.4,5957.0,5512.0
1024,1024,1024,32,32,8,256,5733.35,5900.0,5475.0
1024,1024,1024,32,32,16,16,3702.45,3787.0,3479.0
1024,1024,1024,32,32,16,32,4698.2,5251.0,4583.0
1024,1024,1024,32,32,16,64,4368.95,4799.0,4248.0
1024,1024,1024,32,32,16,128,4120.55,4148.0,4097.0
1024,1024,1024,32,32,16,256,4032.6,4082.0,4008.0
1024,1024,1024,32,32,32,16,7076.05,7455.0,6520.0
1024,1024,1024,32,32,32,32,6772.95,7053.0,6359.0
1024,1024,1024,32,32,32,64,6456.7,6925.0,6105.0
1024,1024,1024,32,32,32,128,6262.75,6515.0,6065.0
1024,1024,1024,32,32,32,256,6320.4,6438.0,6082.0
1024,1024,1024,32,64,8,16,5132.25,5644.0,4971.0
1024,1024,1024,32,64,8,32,6168.2,6368.0,5969.0
1024,1024,1024,32,64,8,64,6040.75,6317.0,5673.0
1024,1024,1024,32,64,8,128,5761.3,6113.0,5494.0
1024,1024,1024,32,64,8,256,5797.5,6321.0,5515.0
1024,1024,1024,32,64,16,16,3724.05,4454.0,3464.0
1024,1024,1024,32,64,16,32,5147.45,5425.0,4802.0
1024,1024,1024,32,64,16,64,4396.05,4749.0,4216.0
1024,1024,1024,32,64,16,128,4277.85,4571.0,4128.0
1024,1024,1024,32,64,16,256,4157.7,4781.0,4019.0
1024,1024,1024,32,64,32,16,7174.1,7549.0,6772.0
1024,1024,1024,32,64,32,32,6466.55,6675.0,6212.0
1024,1024,1024,32,64,32,64,6440.45,6787.0,6186.0
1024,1024,1024,32,64,32,128,6334.05,6789.0,5984.0
1024,1024,1024,32,64,32,256,6345.25,6564.0,6034.0
1024,1024,1024,32,64,64,16,6726.9,7238.0,6421.0
1024,1024,1024,32,64,64,32,6491.55,7544.0,6239.0
1024,1024,1024,32,64,64,64,6157.65,6521.0,6096.0
1024,1024,1024,32,64,64,128,6208.85,6577.0,6075.0
1024,1024,1024,32,128,8,16,5595.45,6179.0,4961.0
1024,1024,1024,32,128,8,32,6450.65,6866.0,5977.0
1024,1024,1024,32,128,8,64,5869.7,6189.0,5680.0
1024,1024,1024,32,128,8,128,5912.2,6115.0,5630.0
1024,1024,1024,32,128,8,256,5519.3,5597.0,5468.0
1024,1024,1024,32,128,16,16,3747.6,4491.0,3472.0
1024,1024,1024,32,128,16,32,4780.6,5009.0,4604.0
1024,1024,1024,32,128,16,64,4480.9,4912.0,4264.0
1024,1024,1024,32,128,16,128,4346.35,4793.0,4130.0
1024,1024,1024,32,128,16,256,4258.85,5015.0,4063.0
1024,1024,1024,32,128,32,16,7351.65,7682.0,7086.0
1024,1024,1024,32,128,32,32,6736.4,7006.0,6338.0
1024,1024,1024,32,128,32,64,6462.45,6746.0,6076.0
1024,1024,1024,32,128,32,128,0.0,0.0,0.0
1024,1024,1024,32,128,32,256,6239.95,6702.0,6006.0
1024,1024,1024,32,128,64,16,7058.95,7626.0,6442.0
1024,1024,1024,32,128,64,32,6324.1,6730.0,6217.0
1024,1024,1024,32,128,64,64,6554.9,6889.0,6401.0
1024,1024,1024,32,128,64,128,6148.35,6221.0,6073.0
1024,1024,1024,32,128,128,16,7175.6,8165.0,6631.0
1024,1024,1024,32,128,128,32,6729.7,6854.0,6413.0
1024,1024,1024,32,128,128,64,6649.3,7045.0,6288.0
1024,1024,1024,32,256,8,16,5560.4,5997.0,5240.0
1024,1024,1024,32,256,8,32,6213.1,6832.0,5931.0
1024,1024,1024,32,256,8,64,6046.05,6646.0,5718.0
1024,1024,1024,32,256,8,128,5727.3,5985.0,5485.0
1024,1024,1024,32,256,8,256,5774.95,5991.0,5479.0
1024,1024,1024,32,256,16,16,3941.45,4720.0,3523.0
1024,1024,1024,32,256,16,32,4981.5,5636.0,4609.0
1024,1024,1024,32,256,16,64,0.0,0.0,0.0
1024,1024,1024,32,256,16,128,4450.75,4730.0,4158.0
1024,1024,1024,32,256,16,256,4132.85,4394.0,4071.0
1024,1024,1024,32,256,32,16,6996.4,7069.0,6857.0
1024,1024,1024,32,256,32,32,6437.6,7126.0,6226.0
1024,1024,1024,32,256,32,64,6404.05,6753.0,6077.0
1024,1024,1024,32,256,32,128,6110.25,6190.0,6043.0
1024,1024,1024,32,256,32,256,6174.75,6720.0,6067.0
1024,1024,1024,32,256,64,16,0.0,0.0,0.0
1024,1024,1024,32,256,64,32,6349.25,6857.0,6261.0
1024,1024,1024,32,256,64,64,6472.7,6788.0,6181.0
1024,1024,1024,32,256,64,128,0.0,0.0,0.0
1024,1024,1024,32,256,128,16,6995.9,7694.0,6500.0
1024,1024,1024,32,256,128,32,6571.65,6909.0,6483.0
1024,1024,1024,32,256,128,64,6320.6,6388.0,6268.0
1024,1024,1024,32,256,256,16,7171.15,7568.0,6887.0
1024,1024,1024,32,512,8,16,5367.05,5652.0,5074.0
1024,1024,1024,32,512,8,32,6268.75,6684.0,5962.0
1024,1024,1024,32,512,8,64,5858.8,6219.0,5706.0
1024,1024,1024,32,512,8,128,5621.55,6105.0,5505.0
1024,1024,1024,32,512,8,256,5673.95,6029.0,5558.0
1024,1024,1024,32,512,16,16,3943.85,4248.0,3624.0
1024,1024,1024,32,512,16,32,5082.2,5397.0,4692.0
1024,1024,1024,32,512,16,64,4685.2,5110.0,4337.0
1024,1024,1024,32,512,16,128,4409.5,4798.0,4146.0
1024,1024,1024,32,512,16,256,4441.3,4628.0,4180.0
1024,1024,1024,32,512,32,16,6872.2,7145.0,6551.0
1024,1024,1024,32,512,32,32,6268.75,6545.0,6243.0
1024,1024,1024,32,512,32,64,6439.45,6757.0,6099.0
1024,1024,1024,32,512,32,128,6294.1,6990.0,6015.0
1024,1024,1024,32,512,32,256,6380.3,6696.0,6085.0
1024,1024,1024,32,512,64,16,7204.35,7492.0,6609.0
1024,1024,1024,32,512,64,32,6794.95,7086.0,6497.0
1024,1024,1024,32,512,64,64,6406.15,6879.0,6200.0
1024,1024,1024,32,512,64,128,6395.7,6687.0,6133.0
1024,1024,1024,32,512,128,16,0.0,0.0,0.0
1024,1024,1024,32,512,128,32,6556.2,6697.0,6382.0
1024,1024,1024,32,512,128,64,6370.8,6512.0,6271.0
1024,1024,1024,32,512,256,16,7049.7,7478.0,6571.0
1024,1024,1024,32,1024,8,16,6800.3,7631.0,6220.0
1024,1024,1024,32,1024,8,32,7125.7,7776.0,6563.0
1024,1024,1024,32,1024,8,64,6373.3,6617.0,6131.0
1024,1024,1024,32,1024,8,128,5836.35,5926.0,5789.0
1024,1024,1024,32,1024,8,256,5903.6,6210.0,5691.0
1024,1024,1024,32,1024,16,16,5674.65,6107.0,4755.0
1024,1024,1024,32,1024,16,32,5480.95,5896.0,5201.0
1024,1024,1024,32,1024,16,64,4923.3,5410.0,4655.0
1024,1024,1024,32,1024,16,128,4341.65,4687.0,4282.0
1024,1024,1024,32,1024,16,256,4477.6,5396.0,4288.0
1024,1024,1024,32,1024,32,16,8766.5,9225.0,8501.0
1024,1024,1024,32,1024,32,32,7306.6,7933.0,6742.0
1024,1024,1024,32,1024,32,64,6566.05,7008.0,6164.0
1024,1024,1024,32,1024,32,128,6409.95,6623.0,6123.0
1024,1024,1024,32,1024,32,256,6455.65,6732.0,6332.0
1024,1024,1024,32,1024,64,16,7772.45,8640.0,7221.0
1024,1024,1024,32,1024,64,32,6846.65,7321.0,6372.0
1024,1024,1024,32,1024,64,64,6466.2,6568.0,6200.0
1024,1024,1024,32,1024,64,128,0.0,0.0,0.0
1024,1024,1024,32,1024,128,16,7342.25,8018.0,6738.0
1024,1024,1024,32,1024,128,32,6667.45,7025.0,6445.0
1024,1024,1024,32,1024,128,64,6445.85,6692.0,6343.0
1024,1024,1024,32,1024,256,16,6913.3,7222.0,6668.0
1024,1024,1024,64,8,8,16,6100.95,6346.0,5787.0
1024,1024,1024,64,8,8,32,6033.3,6326.0,5822.0
1024,1024,1024,64,8,8,64,5803.05,6248.0,5652.0
1024,1024,1024,64,8,8,128,5638.25,6369.0,5362.0
1024,1024,1024,64,8,8,256,5696.2,6200.0,5612.0
1024,1024,1024,64,16,8,16,4782.4,5499.0,4602.0
1024,1024,1024,64,16,8,32,5981.95,6541.0,5778.0
1024,1024,1024,64,16,8,64,5780.3,6457.0,5655.0
1024,1024,1024,64,16,8,128,5487.6,5941.0,5345.0
1024,1024,1024,64,16,8,256,5601.2,5941.0,5365.0
1024,1024,1024,64,16,16,16,3597.55,4045.0,3285.0
1024,1024,1024,64,16,16,32,4666.05,5234.0,4484.0
1024,1024,1024,64,16,16,64,4390.15,5142.0,4222.0
1024,1024,1024,64,16,16,128,0.0,0.0,0.0
1024,1024,1024,64,16,16,256,4117.9,4694.0,4039.0
1024,1024,1024,64,32,8,16,4594.1,4601.0,4590.0
1024,1024,1024,64,32,8,32,6065.5,6326.0,5760.0
1024,1024,1024,64,32,8,64,5954.9,6548.0,5866.0
1024,1024,1024,64,32,8,128,5706.95,6386.0,5367.0
1024,1024,1024,64,32,8,256,5619.45,5760.0,5331.0
1024,1024,1024,64,32,16,16,3371.3,3705.0,3283.0
1024,1024,1024,64,32,16,32,4721.2,4984.0,4406.0
1024,1024,1024,64,32,16,64,4509.35,5068.0,4225.0
1024,1024,1024,64,32,16,128,4413.4,4829.0,4105.0
1024,1024,1024,64,32,16,256,4160.8,4489.0,4015.0
1024,1024,1024,64,32,32,16,6645.8,7155.0,6268.0
1024,1024,1024,64,32,32,32,6556.55,6820.0,6293.0
1024,1024,1024,64,32,32,64,6357.45,6678.0,6060.0
1024,1024,1024,64,32,32,128,6155.05,6798.0,5957.0
1024,1024,1024,64,64,8,16,4591.95,4620.0,4579.0
1024,1024,1024,64,64,8,32,5928.95,6402.0,5783.0
1024,1024,1024,64,64,8,64,5924.25,6548.0,5602.0
1024,1024,1024,64,64,8,128,5711.05,6113.0,5380.0
1024,1024,1024,64,64,8,256,5734.1,6253.0,5357.0
1024,1024,1024,64,64,16,16,3494.7,3906.0,3290.0
1024,1024,1024,64,64,16,32,4809.45,5147.0,4501.0
1024,1024,1024,64,64,16,64,4344.1,4790.0,4189.0
1024,1024,1024,64,64,16,128,4323.2,4565.0,4070.0
1024,1024,1024,64,64,16,256,4325.4,4951.0,4044.0
1024,1024,1024,64,64,32,16,0.0,0.0,0.0
1024,1024,1024,64,64,32,32,6450.4,6685.0,6201.0
1024,1024,1024,64,64,32,64,6287.6,6941.0,6115.0
1024,1024,1024,64,64,32,128,6032.7,6125.0,5990.0
1024,1024,1024,64,64,64,16,6548.5,7313.0,6316.0
1024,1024,1024,64,64,64,32,6503.2,6730.0,6188.0
1024,1024,1024,64,64,64,64,6445.65,6717.0,6233.0
1024,1024,1024,64,128,8,16,4857.3,5165.0,4614.0
1024,1024,1024,64,128,8,32,6047.5,6408.0,5791.0
1024,1024,1024,64,128,8,64,5891.05,6244.0,5667.0
1024,1024,1024,64,128,8,128,5717.95,6163.0,5344.0
1024,1024,1024,64,128,8,256,5352.6,5838.0,5273.0
1024,1024,1024,64,128,16,16,3576.6,3993.0,3315.0
1024,1024,1024,64,128,16,32,4767.65,4967.0,4549.0
1024,1024,1024,64,128,16,64,4509.2,4803.0,4221.0
1024,1024,1024,64,128,16,128,4320.2,4554.0,4072.0
1024,1024,1024,64,128,16,256,4219.95,4421.0,4053.0
1024,1024,1024,64,128,32,16,6653.2,6946.0,6320.0
1024,1024,1024,64,128,32,32,6372.7,6467.0,6152.0
1024,1024,1024,64,128,32,64,6400.6,6968.0,6145.0
1024,1024,1024,64,128,32,128,0.0,0.0,0.0
1024,1024,1024,64,128,64,16,6633.3,7097.0,6322.0
1024,1024,1024,64,128,64,32,6455.7,6723.0,6145.0
1024,1024,1024,64,128,64,64,6309.3,6639.0,6116.0
1024,1024,1024,64,128,128,16,6641.65,6847.0,6346.0
1024,1024,1024,64,128,128,32,6467.8,7005.0,6203.0
1024,1024,1024,64,256,8,16,5141.4,5592.0,4678.0
1024,1024,1024,64,256,8,32,6127.6,6463.0,5895.0
1024,1024,1024,64,256,8,64,5871.4,6236.0,5629.0
1024,1024,1024,64,256,8,128,5744.55,6327.0,5374.0
1024,1024,1024,64,256,8,256,5689.45,5938.0,5346.0
1024,1024,1024,64,256,16,16,3663.15,4009.0,3359.0
1024,1024,1024,64,256,16,32,4614.4,4916.0,4459.0
1024,1024,1024,64,256,16,64,4424.1,4599.0,4219.0
1024,1024,1024,64,256,16,128,4399.95,4567.0,4335.0
1024,1024,1024,64,256,16,256,4395.2,5048.0,4056.0
1024,1024,1024,64,256,32,16,6838.3,7537.0,6475.0
1024,1024,1024,64,256,32,32,6523.5,6822.0,6172.0
1024,1024,1024,64,256,32,64,6374.25,6582.0,6067.0
1024,1024,1024,64,256,32,128,6029.35,6082.0,5969.0
1024,1024,1024,64,256,64,16,6530.3,7276.0,6301.0
1024,1024,1024,64,256,64,32,6441.9,6735.0,6211.0
1024,1024,1024,64,256,64,64,6192.8,6274.0,6120.0
1024,1024,1024,64,256,128,16,6967.8,7522.0,6841.0
1024,1024,1024,64,256,128,32,6400.1,6469.0,6304.0
1024,1024,1024,64,512,8,16,4788.55,5476.0,4693.0
1024,1024,1024,64,512,8,32,6037.05,6331.0,5955.0
1024,1024,1024,64,512,8,64,5835.65,6277.0,5629.0
1024,1024,1024,64,512,8,128,5740.45,5963.0,5412.0
1024,1024,1024,64,512,8,256,5792.55,5972.0,5646.0
1024,1024,1024,64,512,16,16,3599.05,4019.0,3377.0
1024,1024,1024,64,512,16,32,4695.3,5069.0,4453.0
1024,1024,1024,64,512,16,64,4316.7,4697.0,4188.0
1024,1024,1024,64,512,16,128,4433.7,4687.0,4089.0
1024,1024,1024,64,512,16,256,4393.6,4627.0,4086.0
1024,1024,1024,64,512,32,16,6604.3,6944.0,6431.0
1024,1024,1024,64,512,32,32,6541.75,7028.0,6184.0
1024,1024,1024,64,512,32,64,6267.8,6507.0,6049.0
1024,1024,1024,64,512,32,128,6284.2,6495.0,5996.0
1024,1024,1024,64,512,64,16,6657.75,6933.0,6342.0
1024,1024,1024,64,512,64,32,6617.45,6895.0,6331.0
1024,1024,1024,64,512,64,64,6468.1,7170.0,6118.0
1024,1024,1024,64,512,128,16,0.0,0.0,0.0
1024,1024,1024,64,512,128,32,6597.5,6938.0,6241.0
1024,1024,1024,64,1024,8,16,6189.75,6524.0,5582.0
1024,1024,1024,64,1024,8,32,6442.8,6720.0,6186.0
1024,1024,1024,64,1024,8,64,6197.95,6526.0,5930.0
1024,1024,1024,64,1024,8,128,5689.45,6150.0,5485.0
1024,1024,1024,64,1024,8,256,5817.25,6249.0,5468.0
1024,1024,1024,64,1024,16,16,4700.85,5017.0,4337.0
1024,1024,1024,64,1024,16,32,5292.6,5643.0,4841.0
1024,1024,1024,64,1024,16,64,4649.45,4987.0,4369.0
1024,1024,1024,64,1024,16,128,4495.5,4941.0,4243.0
1024,1024,1024,64,1024,16,256,4509.1,4761.0,4387.0
1024,1024,1024,64,1024,32,16,7675.1,8121.0,7227.0
1024,1024,1024,64,1024,32,32,6627.1,7058.0,6341.0
1024,1024,1024,64,1024,32,64,6390.35,6626.0,6069.0
1024,1024,1024,64,1024,32,128,6125.8,6384.0,6029.0
1024,1024,1024,64,1024,64,16,7223.1,7750.0,6637.0
1024,1024,1024,64,1024,64,32,6535.45,6953.0,6265.0
1024,1024,1024,64,1024,64,64,6171.85,6274.0,6107.0
1024,1024,1024,64,1024,128,16,6708.8,6779.0,6626.0
1024,1024,1024,64,1024,128,32,6436.8,6497.0,6387.0
1024,1024,1024,128,8,8,16,6540.1,6822.0,6273.0
1024,1024,1024,128,8,8,32,6189.55,6458.0,5974.0
1024,1024,1024,128,8,8,64,5773.95,6247.0,5599.0
1024,1024,1024,128,8,8,128,5725.15,6362.0,5456.0
1024,1024,1024,128,16,8,16,4912.6,5274.0,4592.0
1024,1024,1024,128,16,8,32,6124.5,6822.0,5869.0
1024,1024,1024,128,16,8,64,5965.25,6476.0,5620.0
1024,1024,1024,128,16,8,128,5746.9,6147.0,5511.0
1024,1024,1024,128,16,16,16,3406.2,3609.0,3260.0
1024,1024,1024,128,16,16,32,4799.5,5016.0,4555.0
1024,1024,1024,128,16,16,64,4538.35,4752.0,4286.0
1024,1024,1024,128,16,16,128,4340.5,4690.0,4092.0
1024,1024,1024,128,32,8,16,4899.5,5547.0,4762.0
1024,1024,1024,128,32,8,32,6265.05,6480.0,5976.0
1024,1024,1024,128,32,8,64,5960.7,6066.0,5653.0
1024,1024,1024,128,32,8,128,5567.35,6168.0,5460.0
1024,1024,1024,128,32,16,16,3316.6,3584.0,3249.0
1024,1024,1024,128,32,16,32,4873.65,5126.0,4545.0
1024,1024,1024,128,32,16,64,4537.3,5243.0,4275.0
1024,1024,1024,128,32,16,128,4394.4,4742.0,4093.0
1024,1024,1024,128,32,32,16,6801.4,6959.0,6662.0
1024,1024,1024,128,32,32,32,6561.05,6861.0,6304.0
1024,1024,1024,128,32,32,64,6343.85,6519.0,6027.0
1024,1024,1024,128,64,8,16,4601.85,4675.0,4573.0
1024,1024,1024,128,64,8,32,6162.05,6443.0,5904.0
1024,1024,1024,128,64,8,64,0.0,0.0,0.0
1024,1024,1024,128,64,8,128,5775.3,6080.0,5488.0
1024,1024,1024,128,64,16,16,3608.35,3891.0,3353.0
1024,1024,1024,128,64,16,32,4828.7,5385.0,4575.0
1024,1024,1024,128,64,16,64,4535.3,4628.0,4285.0
1024,1024,1024,128,64,16,128,4294.45,4620.0,4101.0
1024,1024,1024,128,64,32,16,6752.9,6954.0,6418.0
1024,1024,1024,128,64,32,32,6465.4,6754.0,6158.0
1024,1024,1024,128,64,32,64,6324.2,6497.0,6061.0
1024,1024,1024,128,64,64,16,6539.25,7213.0,6306.0
1024,1024,1024,128,64,64,32,6360.9,6627.0,6178.0
1024,1024,1024,128,128,8,16,4742.15,5003.0,4598.0
1024,1024,1024,128,128,8,32,6189.9,6567.0,5908.0
1024,1024,1024,128,128,8,64,5911.95,6560.0,5624.0
1024,1024,1024,128,128,8,128,5532.75,5601.0,5474.0
1024,1024,1024,128,128,16,16,3462.3,4075.0,3361.0
1024,1024,1024,128,128,16,32,4844.25,5466.0,4544.0
1024,1024,1024,128,128,16,64,4608.1,5067.0,4300.0
1024,1024,1024,128,128,16,128,4396.95,4632.0,4110.0
1024,1024,1024,128,128,32,16,6649.95,6854.0,6360.0
1024,1024,1024,128,128,32,32,6505.25,6679.0,6240.0
1024,1024,1024,128,128,32,64,6155.25,6587.0,6067.0
1024,1024,1024,128,128,64,16,0.0,0.0,0.0
1024,1024,1024,128,128,64,32,6326.15,6613.0,6225.0
1024,1024,1024,128,256,8,16,4998.9,5874.0,4648.0
1024,1024,1024,128,256,8,32,6209.25,6538.0,5973.0
1024,1024,1024,128,256,8,64,5794.85,6246.0,5634.0
1024,1024,1024,128,256,8,128,5778.5,6103.0,5539.0
1024,1024,1024,128,256,16,16,3653.45,3961.0,3483.0
1024,1024,1024,128,256,16,32,4720.85,5225.0,4608.0
1024,1024,1024,128,256,16,64,4308.35,4391.0,4271.0
1024,1024,1024,128,256,16,128,4238.15,4716.0,4111.0
1024,1024,1024,128,256,32,16,6794.45,7263.0,6465.0
1024,1024,1024,128,256,32,32,6503.1,6842.0,6239.0
1024,1024,1024,128,256,32,64,6192.15,6542.0,6045.0
1024,1024,1024,128,256,64,16,6638.15,6925.0,6367.0
1024,1024,1024,128,256,64,32,6504.5,6820.0,6214.0
1024,1024,1024,128,512,8,16,5026.6,5284.0,4804.0
1024,1024,1024,128,512,8,32,6061.1,6128.0,6027.0
1024,1024,1024,128,512,8,64,5698.85,5848.0,5630.0
1024,1024,1024,128,512,8,128,5711.65,5946.0,5636.0
1024,1024,1024,128,512,16,16,3751.65,4648.0,3498.0
1024,1024,1024,128,512,16,32,4859.9,5570.0,4623.0
1024,1024,1024,128,512,16,64,4638.7,5175.0,4319.0
1024,1024,1024,128,512,16,128,4689.1,5241.0,4320.0
1024,1024,1024,128,512,32,16,6548.3,6716.0,6486.0
1024,1024,1024,128,512,32,32,6481.5,6868.0,6227.0
1024,1024,1024,128,512,32,64,6300.2,6800.0,6083.0
1024,1024,1024,128,512,64,16,6711.95,7031.0,6495.0
1024,1024,1024,128,512,64,32,6689.55,7228.0,6315.0
1024,1024,1024,128,1024,8,16,5659.15,6003.0,5417.0
1024,1024,1024,128,1024,8,32,6302.1,6413.0,6180.0
1024,1024,1024,128,1024,8,64,6063.65,6360.0,5782.0
1024,1024,1024,128,1024,8,128,6003.4,6338.0,5776.0
1024,1024,1024,128,1024,16,16,4100.15,4611.0,3943.0
1024,1024,1024,128,1024,16,32,5063.9,5371.0,4784.0
1024,1024,1024,128,1024,16,64,4665.7,4952.0,4361.0
1024,1024,1024,128,1024,16,128,4567.4,5452.0,4388.0
1024,1024,1024,128,1024,32,16,7279.15,7582.0,6990.0
1024,1024,1024,128,1024,32,32,0.0,0.0,0.0
1024,1024,1024,128,1024,32,64,6353.75,6699.0,6087.0
1024,1024,1024,128,1024,64,16,6976.45,7373.0,6876.0
1024,1024,1024,128,1024,64,32,6612.55,6840.0,6365.0
